,Unnamed:,Ragione socialeCaratteri latini,Inactive,Quoted,Branch,OwnData,Woco,Codice ISO paese,"Codice NACE Rev. , core code ( cifre)",Codice di consolidamento,Ultimo anno disp.,Totale valore della produzione   Ultimo anno disp.,Numero dipendenti Ultimo anno disp.,Address line  Latin Alphabet,CAP Latin Alphabet,Città Latin Alphabet,Paese,Codice ISO paese.,ISO territory code,Codice ISO paese.,Regione nel paese,Metropolitan Statistical Area,Area geografica,Descrizione dell'attività (in inglese),Descrizione dell'attività nella lingua originale,Lingua originale della descrizione dell'attività,Prodotti e servizi,Descrizione e storico,Numero BvD ID,BvD account number,Numero Orbis ID,ID nazionale,Denominazione ID nazionale,Tipologia ID nazionale,Numero al registro delle imprese,Codice fiscale/Partita IVA,Partita IVA comunitaria,ESCB Financial Vehicle Corporation ID,ESCB Monetary Financial Institution ID,Tax Identification Number (TIN),LEI (Identificativo della persona giuridica),Numero statistico,Altro numero ID società,Numero SIRET precedente (Francia),Data numero SIRET precedente (Francia),SWIFT_CODE,ID Information provider,Sigla ID dell'information provider,Ticker symbol,Numero ISIN,Numero ISIN (Tutto),Data di pubblicazione,Information provider,Data registrazione informazione dall'information provider,Classificazione per dimensione,Stato attivita,Data situazione giuridica,Data di aggiornamento situazione giuridica,Situazione giuridica locale,Data situazione giuridica locale,Data variazione situazione giuridica locale,Forma giuridica standardizzata,Forma giuridica nazionale,Indicatore filiale,Data di costituzione,Stato di costituzione della società (in USA),State or province of incorporation (in US or Canada),Tipologia di ente,Woman owned indicator (in US),Ethnic minority owned indicator (in US),Storico (banche),Data chiusura,Anno fiscale,Trimestre,Periodo di competenza,Stato revisione/audit,Status bilancio,Principi contabili,Fonte dati di bilancio,Unità originale,Valuta originale,Tasso di cambio con la valuta originale,Totale valore della produzione,Utile/Perdita prima delle imposte,Utile/perdita di esercizio [utile netto],Flusso finanziario,Totale Attivo,Patrimonio netto,Indice di disponibilità,Margine di profitto,Redditività del capitale proprio (ROE) - Lordo,Rendimento del capitale investito (ROCE) - Lordo,Coefficiente di solvibilità (sulla base del patrimonio),Numero dipendenti,Immobilizzazioni,Immobilizzazioni immateriali,Immobilizzazioni materiali,Altre immobilizzazioni,Attività correnti,Rimanenze,Crediti verso clienti,Altro (Attivo circolante),Disponibilità liquide e mezzi equivalenti,Totale Attivo   .,Patrimonio netto   .,Capitale sociale,Riserve e altri fondi,Passività non correnti,Indebitamento a lungo termine,Altre passività non correnti,Fondi per rischi e oneri,Passività correnti,Debiti,Debiti vs Fornitori,Altre passività correnti,Totale passivo,Capitale circolante,Capitale circolante netto,Valore d'impresa (enterprise value),Numero dipendenti .,Totale valore della produzione   .,Ricavi vendite e prestazioni,Costo del venduto,Margine sui consumi,Oneri diversi di gestione,Risultato operativo [EBIT],Proventi/oneri finanziari,Proventi finanziari,Oneri finanziari,Utile/Perdita prima delle imposte   .,Totale imposte,Utile/Perdita al netto delle imposte,Totale proventi/oneri straordinari e di altra natura,Proventi straordinari e di altra natura,Oneri straordinari e di altra natura,Utile/perdita di esercizio [utile netto]   .,Ricavi dalle esportazioni,Costi per materie prime,Costo del personale,Ammortamenti e svalutazioni,Altre voci reddituali operative,Interessi corrisposti,Costi per ricerca e sviluppo,Flusso finanziario   .,Valore aggiunto,EBITDA,Utile dell'esercizio,Ammortamenti e svalutazioni   .,Ammortamenti e svalutazioni   .,Ammortamento di immobilizzazioni immateriali,Imposte sul reddito diff. e credito d'imposta per gli investimenti,Altri flussi finanziari,Fondi da attività di gestione prima delle variazioni del capitale circolante e poste straordinarie,Dec/Inc crediti,Dec/Inc rimanenze,Inc/Dec debiti esigibili,Inc/Dec altri accantonamenti,Dec/Inc altre attività/passività,Voci straordinarie,Fondi da altre attività operative,Liquidità netta da attività operative,Acquisizione di immobilizzazioni,Inc/Dec altre immobilizzazioni,Inc/Dec di partecipazioni,Liquidità netta utilizzata nelle att. di investimento,Inc/Dec indebitamento a breve termine,Inc/Dec indebitamento a lungo termine,Proventi netti da vendita/emissione di azioni ord. e priv.,Riserva di patrimonio netto,Dividendi da azioni ordinarie,Dividendi da azioni privilegiate,Dividendi corrisposti - Totale,Altre fonti/utilizzi - Attività di finanziamento,Liquidità netta fornita/utilizzata dalle att. di finanziamento,Effetto variazione cambi su disponibilità liquide,Inc/Dec disponibilità liquide e attività finanziarie che non costituiscono immobilizzazioni,Saldo iniziale disponibilità liquide e mezzi equivalenti,Saldo finale disponibilità liquide e mezzi equivalenti,Redditività del capitale proprio (ROE) - Lordo .,Rendimento del capitale investito (ROCE) - Lordo .,Redditività del totale Attivo (ROA) - Lordo,Redditività del capitale proprio (ROE) - Netto,Rendimento del capitale investito (ROCE) - Netto,Redditività del totale Attivo (ROA) - Netto,Margine di profitto .,Margine lordo,Margine EBITDA,Margine EBIT,Flusso finanziario / Ricavi di gestione,Enterprise value / EBITDA,Cap. di Mercato / Flusso finanziario da attività operativa,Rotazione netta dell'attivo,Copertura degli interessi,Rotazione delle scorte,Tempi di incasso,Tempi di pagamento,Ricavi da esportazioni / Ricavi di gestione,Costi di ricerca e sviluppo / Ricavi di gestione,Indice di disponibilità .,Indice di liquidità,Indice di liquidità degli azionisti,Coefficiente di solvibilità (sulla base del patrimonio) .,Coefficiente di solvibilità (sulla base della liquidità),Indice di leva (gearing),Ricavi pro-capite,Ricavi di gestione pro-capite,Costo lavoro/ Ricavi di gestione,Costo lavoro pro-capite,Patrimonio netto per dipendente,Capitale circolante per dipendente,Totale attività per dipendente
0,1,ENEL SPA,No,Sì,No,No,Sì,IT,3511,C2,2023,108351928.627014,61055,VIALE REGINA MARGHERITA 137,198.0,ROMA,Italia,IT,IT,IT,Lazio,,Western Europe,"The main activity of the Company is the sale of electricity and gas products and services for end users. The management of power generation and is involved in thermal generation with regasification, natural gas and hydroelectric plants that can be programmed.","La Società è stata costituita il 27 novembre 1992, in Italia. La Società detiene come attività principale la vendita di prodotti e servizi di elettricità e gas para los usuarios finalis. La gestione della generazione di energia ed è coinvolta nella generazione termica con la rigassificazione, il gas naturale e le centrali idroelettriche che si possono programmare. Las infraestructuras y redes de distribución eléctrica y alumbrado público. Il segmento internazionale apoya las estrategias para los mercados europeos y rusos. L'energia rinnovabile è attiva nella generación de electricidad a partir de recursos renovables. L'ingegneria e le indagini se desarrolla la costruzione convenzionale e nucleare degli impianti di energia. La Compañía cotiza en la Bolsa de Valores de Milán.",Italian,Electricity and gas [source: Bureau van Dijk],"The Company was created on November 27, 1992, in Italy. The main activity of the Company is the sale of electricity and gas products and services for end users. The management of power generation and is involved in thermal generation with regasification, natural gas and hydroelectric plants that can be programmed. Infrastructures and electrical distribution networks and public lighting. The International segment supports strategies for the European and Russian markets. Renewable energy is active in generating electricity from renewable resources. Engineering and research develops the conventional and nuclear construction of power plants. The Company is listed on the Milan Stock Exchange.",IT00811720580,IT00811720580IC,5340197,RM0756032,CCIAA number,Numero iscrizione al registro delle imprese,RM0756032,811720580.0,IT00934061003,,,811720580.0,WOCMU6HCI0OJWNPRZS33,,0001096200,,,,A22B8,Refinitiv Number,ENEL,IT0003128367,CH0195757254,2024-04-24,World'Vest Base Inc.,,Very large company,Active,,,,,,Società per azioni,Società anonima - SA,No,1962,,,Azienda,,,,2010-12-31,2010.0,,12,Unqualified,Original,IFRS,AR,thousands,EUR,1.33689844608307,98097597.2782373,10794118.0536747,5868984.17830467,14187166.3098335,224668457.661152,71584227.2955179,1.064,11.003,15.079,9.402,31.862,79913,176330220.546126,52233959.1869116,104403747.248411,19692514.1108036,48338237.1150255,3747326.34437084,16570856.2391996,28020054.531455,22842246.8497753,224668457.661152,71584227.2955179,12570856.0885191,59013371.2069988,107640378.386378,74905083.0355882,32735295.35079,16169786.7053747,45443851.9792557,14983957.783699,16541444.4733858,13918449.7221708,224668457.661152,3776738.11018467,2894385.13576984,117698325.04178,79913,98097597.2782373,96180484.9065542,65737970.3907967,32359626.8874407,17157754.6570301,15201872.2304106,-4407754.17673588,2461230.03923893,6868984.21597481,10794118.0536747,3209893.16904545,7584224.88462925,-1715240.70632458,n.d.,n.d.,5868984.17830467,n.d.,48739306.6488504,6560160.67492962,8318182.13152885,2163101.68576241,6056149.9607563,116310.164809227,14187166.3098335,30013370.1145649,23520054.3619394,n.d.,n.d.,n.d.,n.d.,n.d.,n.d.,n.d.,n.d.,n.d.,n.d.,n.d.,n.d.,n.d.,n.d.,n.d.,n.d.,n.d.,n.d.,n.d.,n.d.,n.d.,n.d.,n.d.,n.d.,n.d.,n.d.,n.d.,n.d.,n.d.,n.d.,n.d.,n.d.,15.079,9.402,4.804,8.199,6.654,2.612,11.003,32.987,23.976,15.497,14.462,5.004,n.d.,0.547,2.51,26.178,60.812,60.704,n.d.,0.119,1.064,0.981,0.665,31.862,46.761,171.301,135.073367387697,1227.5549326058,6.687,82.0912825041543,895.776998984681,47.2606221011696,2811.41313264428
1,2,ENI S.P.A.,No,Sì,No,No,Sì,IT,610,C1,2023,105270082.243919,33142,PIAZZALE ENRICO MATTEI 1,144.0,ROMA,Italia,IT,IT,IT,Lazio,,Western Europe,"The Company's main activity is the production, transformation and marketing of oil, gas and electricity, petrochemicals, engineering and construction.","La Società è stata creata il 10 febbraio 1953 in Italia. L'attività principale dell'azienda è la produzione, trasformazione e commercializzazione di petrolio, gas ed elettricità, petrolchimica, ingegneria e costruzioni. La società è quotata alla borsa di Milano, Francoforte e Nyse.",Italian,Oil and natural gas [source: Bureau van Dijk],"The Company was created on February 10, 1953 in Italy. The Company's main activity is the production, transformation and marketing of oil, gas and electricity, petrochemicals, engineering and construction. The Company is listed in the stock exchange of Milan, Frankfurt, and Nyse.",IT00484960588,IT00484960588IC,5340206,RM0756453,CCIAA number,Numero iscrizione al registro delle imprese,RM0756453,484960588.0,IT00905811006,,,484960588.0,BUCRF72VH5RBN7X3VL35,,0001002242,,,,A12C4,Refinitiv Number,ENI,IT0003132476,ARDEUT112612,2024-06-25,World'Vest Base Inc.,,Very large company,Active,,,,,,Società per azioni,Società anonima - SA,No,1953,,,Azienda,,,,2010-12-31,2010.0,,12,Unqualified,Original,IFRS,AR,thousands,EUR,1.33689844608307,132993320.517898,22112300.298214,8446524.38235283,21252674.5973825,176283429.100513,74502676.6033173,1.002,16.627,29.68,18.098,42.263,79941,129610967.449307,14935829.43964,90112302.8597832,24562835.1498842,46672461.651206,8808823.86124134,23907754.9113035,13955882.8786612,2581550.89938641,176283429.100513,74502676.6033173,5354278.27656269,69148398.3267546,55193852.3465395,27145722.9477167,28048129.3988228,16667112.9273176,46586900.1506567,9997326.57980919,17528075.5265951,19061498.0442524,176283429.100513,15188503.2459497,85561.5005493164,122369928.138632,79941,132993320.517898,131715245.603442,84812837.4195099,48180483.0983877,24935829.8163414,23244653.2820463,-1132352.98383236,314171.134829521,1446524.11866188,22112300.298214,12241979.0707827,9870321.2274313,-1423796.84507847,n.d.,n.d.,8446524.38235283,n.d.,64520055.906415,6741978.86359692,12806150.2150297,5092246.18113041,1359625.71966648,295454.556584358,21252674.5973825,41596258.2514286,36050803.497076,n.d.,n.d.,n.d.,n.d.,n.d.,n.d.,n.d.,n.d.,n.d.,n.d.,n.d.,n.d.,n.d.,n.d.,n.d.,n.d.,n.d.,n.d.,n.d.,n.d.,n.d.,n.d.,n.d.,n.d.,n.d.,n.d.,n.d.,n.d.,n.d.,n.d.,n.d.,n.d.,29.68,18.098,12.544,11.337,7.561,4.791,16.627,36.228,27.107,17.478,15.98,3.394,n.d.,1.025,17.096,15.098,64.716,47.447,n.d.,0.222,1.002,0.813,1.35,42.263,73.199,87.502,276.607752398461,1663.64344368571,5.069,84.336933658267,931.970786444363,189.996413574303,2205.16917665191
2,3,TELECOM ITALIA S.P.A,No,Sì,No,No,Sì,IT,6190,C1,2023,18234718.1835175,47180,VIA GAETANO NEGRI 1,20123.0,MILANO,Italia,IT,IT,IT,,,Western Europe,"The main activities of the Company is related to telecommunications sectors, with the Telecom Italia, TIM and Virgilio brands.",,,"Offers easy-to-use, innovative products packed with advanced features (cordless VoIP phones and the new videophone) with price plans that are flexible enough to cater to all client needs: flat-rate plans for traditional voice telephony, internet telephony plans, voice/data bundles and integrated fixed line/mobile solutions [source: Bureau van Dijk]","The Company was founded on December 31, 1992 in Italy. The main activities of the Company is related to telecommunications sectors, with the Telecom Italia, TIM and Virgilio brands. The Company is listed on the Milan Stock Exchange (Italian Borsa).

Activities by sector:
-Domestic
-Brazi
-Other activities",IT00488410010,IT00488410010IC,60527510,MI1580695,CCIAA number,Numero iscrizione al registro delle imprese,MI1580695,488410010.0,IT00488410010,,,488410010.0,549300W384M3RI3VXU42,,0000948642,,,,A78DE,Refinitiv Number,TIT,IT0003497168,ARDEUT112059,2024-03-27,World'Vest Base Inc.,,Very large company,Active,,,,,,Società per azioni,Società anonima - SA,No,1992,,,Azienda,,,,2010-12-31,2010.0,,12,Unqualified,Original,IFRS,AR,thousands,EUR,1.33689844608307,37200536.1607075,5517379.88698483,4172460.05022526,11672460.3327513,119159095.39783,43596258.3267689,0.863,14.831,12.656,9.133,36.587,84200,98318185.521841,69271392.9837942,22125669.2826748,6921123.25537205,20840909.875989,517379.698634148,8564171.44560814,11759358.7317467,9258021.73912525,119159095.39783,43596258.3267689,14171123.5284805,29425134.7982883,51403745.251894,42828878.6187172,8574866.6331768,2659091.00925922,24159091.8191671,8528075.1875639,6608289.01898861,9022727.61261463,119159095.39783,2473262.12525368,-3318181.94317818,59815554.4351589,84200,37200536.1607075,36859627.0569563,9347593.93501282,27852942.2256947,20081551.5586138,7771390.66708088,-2254010.78009605,323529.423952103,2577540.20404816,5517379.88698483,732620.348453522,4784759.5385313,-612299.488306046,n.d.,n.d.,4172460.05022526,n.d.,2096256.76345825,5375668.65170002,7500000.28252602,6272727.50902176,3159091.02809429,933155.115365982,11672460.3327513,20939840.3609991,15271390.9496069,n.d.,n.d.,n.d.,n.d.,n.d.,n.d.,n.d.,n.d.,n.d.,n.d.,n.d.,n.d.,n.d.,n.d.,n.d.,n.d.,n.d.,n.d.,n.d.,n.d.,n.d.,n.d.,n.d.,n.d.,n.d.,n.d.,n.d.,n.d.,n.d.,n.d.,n.d.,n.d.,12.656,9.133,4.63,9.571,7.717,3.502,14.831,74.872,41.052,20.891,31.377,3.917,n.d.,0.392,2.46,71.902,82.878,63.95,n.d.,2.508,0.863,0.841,0.848,36.587,57.695,137.47,65.527077334724,441.811592846311,14.451,63.8440451857624,517.770289557952,29.3736588605204,1415.19115625162
3,4,LEONARDO S.P.A.,No,Sì,No,No,Sì,IT,3030,C1,2023,17607077.9018402,31255,PIAZZA MONTE GRAPPA 4,195.0,ROMA,Italia,IT,IT,IT,Lazio,,Western Europe,"The Company's main activity is to create technological capabilities in the aerospace, defense and security fields, it is the protagonist of the main strategic programs at a global level, it is a technological partner of governments, defense administrations, institutions and companies.","La Società è stata costituita il 18 marzo 1948 in Italia. L'attività principale della Società è creare capacità tecnologiche nei campi dell'aerospazio, della difesa e della sicurezza, è protagonista dei principali programmi strategici a livello globale, è partner tecnologico di governi, amministrazioni della difesa, istituzioni e aziende. La Società è quotata alla Borsa Italiana.",Italian,Management activities of a holding company [source: Bureau van Dijk],"The Company was established on March 18, 1948 in Italy. The Company's main activity is to create technological capabilities in the aerospace, defense and security fields, it is the protagonist of the main strategic programs at a global level, it is a technological partner of governments, defense administrations, institutions and companies. The Company is listed on the Italian Stock Exchange.",IT00401990585,IT00401990585IC,5333267,RM0007031,CCIAA number,Numero iscrizione al registro delle imprese,RM0007031,401990585.0,IT00881841001,,,401990585.0,529900X4EEX1U9LN3U39,,0001674928,,,,30113EI,WVB number,LDO,IT0003856405,IT0001407847,2024-07-01,World'Vest Base Inc.,,Very large company,Active,,,,,,Società per azioni,Società anonima - SA,No,1948,,,Azienda,,,,2010-12-31,2010.0,,12,Unqualified,Original,IFRS,AR,thousands,EUR,1.33689844608307,25754011.6653442,1086898.43666553,1414438.55595589,2402406.50761127,41553477.5011539,9489305.17029762,1.035,4.22,11.454,9.821,22.836,75197,18237968.6014652,11939840.0219679,4371657.91869164,1926470.6608057,23315508.8996887,5917112.52236366,6247326.43854618,11151069.9387789,3566845.05414963,41553477.5011539,9489305.17029762,3364973.38879108,6124331.78150654,9526738.32678795,6073529.64055538,3453208.68623257,1917112.37168312,22537434.0040684,243315.517187119,6323529.64997292,15970588.8369083,41553477.5011539,5840909.31093693,778074.895620346,10751833.5461643,75197,25754011.6653442,24993316.449523,13823529.9324989,11930481.7328453,10308823.9177465,1621657.81509876,-534759.378433228,286096.267461777,820855.645895004,1086898.43666553,-413101.619839668,1500000.0565052,-85561.5005493164,n.d.,n.d.,1414438.55595589,n.d.,8312834.53774452,6379679.3847084,987967.951655388,227272.735834122,780748.692512512,2713903.84554863,2402406.50761127,9149732.96499252,2609625.76675415,744652.434468269,1049465.28017521,n.d.,n.d.,n.d.,887700.568199158,2681818.28284264,-725935.856223106,327540.119290352,n.d.,n.d.,-550802.159786224,n.d.,-949197.896718979,1732620.38612366,-1225935.87505817,52139.0393972397,-110962.571024895,-1284759.40668583,342246.002197266,-669786.121487617,n.d.,n.d.,n.d.,n.d.,-343582.900643349,-854278.107047081,-1525401.12698078,40106.9533824921,-1037433.19416046,3516042.91319847,2478609.71903801,11.454,9.821,2.616,14.906,11.544,3.404,4.22,46.325,10.133,6.297,9.328,4.12,3.788,1.354,2.077,4.352,87.328,88.393,n.d.,10.538,1.035,0.772,0.996,22.836,29.595,102.959,14.4540139134686,342.487222794588,24.772,84.8395459766657,126.192603684174,77.6747649581044,552.594884452687
4,5,HERA SPA,No,Sì,No,No,Sì,IT,3511,C1,2023,17199443.2188988,9965,VIALE CARLO BERTI PICHAT 2/4,40127.0,BOLOGNA,Italia,IT,IT,IT,Emilia-Romagna,,Western Europe,"The main activity of the Company is related to production of electrical energy, as well as providing water collection, treatment, purification and distribution services; it also participates in the distribution and sale of gas.","La Società è stata costituita il 22 maggio 2002 in Italia. L'attività principale della Società è la produzione di energia elettrica, oltre a fornire servizi di raccolta, trattamento, depurazione e distribuzione dell'acqua; partecipa inoltre alla distribuzione e vendita di gas. La Società è quotata alla Borsa di Milano.",Italian,Gas for public and commercial sectors as well as electricity and drinking water [source: Bureau van Dijk],"The Company was founded on May 22, 2002, in Italy. The Company is related to production of electrical energy, as well as providing water collection, treatment, purification and distribution services; it also participates in the distribution and sale of gas. The Company is listed on the Milan Stock Exchange.",IT04245520376,IT04245520376IC,5251722,BO0363550,CCIAA number,Numero iscrizione al registro delle imprese,BO0363550,4245520376.0,IT04245520376,,,4245520376.0,8156009414FD99443B48,,0001623633,,,,30280EI,WVB number,HER,IT0001250932,BBG006NSJCS2,2024-04-09,World'Vest Base Inc.,,Very large company,Active,,,,,,Società per azioni,Società anonima - SA,No,2002,,,Azienda,,,,2010-12-31,2010.0,,12,Unqualified,Original,IFRS,AR,thousands,EUR,1.33689844608307,5185821.05096555,274905.090569615,156708.562052965,456475.953024387,8290432.13048351,2309496.07630384,1.255,5.301,11.903,8.924,27.857,6516,5637601.81664729,2815611.06863129,2460203.30123234,361787.446783662,2652830.31383622,95064.1747040749,1491594.97597468,1066171.16315746,736660.455557585,8290432.13048351,2309496.07630384,1490660.48396087,818835.592342973,3866524.20982361,3164018.83576655,702505.374057055,409907.769451976,2114411.84435606,203791.451527119,1392179.1968286,518441.196000338,8290432.13048351,194479.95385015,538418.469480157,4979300.93814887,6516,5185821.05096555,4904496.17405784,3935585.70975137,1250235.34121418,738147.086629629,512088.254584551,-237183.164014935,121685.833460927,358868.997475863,274905.090569615,84993.3187097311,189911.771859884,-33203.2098069191,n.d.,n.d.,156708.562052965,n.d.,2861591.01688743,483864.991489291,299767.390971422,-45485.2958310843,276259.368695498,0,456475.953024387,1301593.63191891,811855.645555973,n.d.,n.d.,n.d.,n.d.,n.d.,n.d.,n.d.,n.d.,n.d.,n.d.,n.d.,n.d.,n.d.,n.d.,n.d.,n.d.,n.d.,n.d.,n.d.,n.d.,n.d.,n.d.,n.d.,n.d.,n.d.,n.d.,n.d.,n.d.,n.d.,n.d.,n.d.,n.d.,11.903,8.924,3.316,6.785,7.01,1.89,5.301,24.109,15.655,9.875,8.802,6.133,n.d.,0.84,1.854,54.551,103.547,96.645,n.d.,0,1.255,1.21,0.597,27.857,38.614,176.243,42.1892408940872,795.859584792972,9.331,74.2579787331369,354.434633672456,29.8465251884937,1272.31923375731
5,6,PRYSMIAN S.P.A.,No,Sì,No,No,Sì,IT,2630,C1,2023,17049052.6514053,30088,VIALE SARCA 222,20126.0,MILANO,Italia,IT,IT,IT,Lombardia,,Western Europe,"The main activity of the Company is the design, development, production, supply and installation of various cables for applications in the energy and telecommunications industries throughout the world.","La Società nasce nel 1879, in Italia. L'attività principale della Società è la progettazione, lo sviluppo, la produzione, la fornitura e l'installazione di vari cavi per applicazioni nei settori dell'energia e delle telecomunicazioni in tutto il mondo. La Società è quotata alla Borsa Italiana.",Italian,"Designs, develops, produces, distributes and installs a wide range of cables for the transmission of electricity at low, medium, high and very high voltage, for terrestrial and submarine applications, as well as cable accessories such as junctions and terminals [source: Bureau van Dijk]","The Company was created in 1879, in Italy. The main activity of the Company is the design, development, production, supply and installation of various cables for applications in the energy and telecommunications industries throughout the world. The Company is listed on the Italian Stock Exchange.",IT04866320965,IT04866320965IC,58882794,MI1777895,CCIAA number,Numero iscrizione al registro delle imprese,MI1777895,4866320965.0,IT04866320965,,,4866320965.0,529900X0H1IO3RS1A464,,0001437672,,,,30383EI,WVB number,PRY,IT0004176001,IT0004176001,2024-03-20,World'Vest Base Inc.,,Very large company,Active,,,,,,Società per azioni,Società anonima - SA,No,1879,,,Azienda,,,,2010-12-31,2010.0,,12,Unqualified,Original,IFRS,AR,thousands,EUR,1.33689844608307,6168449.43022728,263368.993878365,176470.594882965,308823.541045189,5033422.64950275,1068181.85842037,1.706,4.27,24.656,14.066,21.222,12352,1489304.86893654,78877.0083189011,1268716.62533283,141711.235284805,3544117.78056622,802139.067649841,1021390.41280746,1720588.30010891,1000000.03767014,5033422.64950275,1068181.85842037,24064.1720294952,1044117.68639088,1887700.60586929,1549465.29901028,338235.306859016,244652.415633202,2077540.18521309,268716.587662697,1152406.46052361,656417.137026787,5033422.64950275,671123.019933701,1466577.59535313,3954715.56017993,12352,6168449.43022728,6110962.79704571,3862299.61073399,2306149.81949329,1954545.52817345,351604.291319847,-88235.2974414825,14705.8829069138,102941.180348396,263368.993878365,84224.6021032333,179144.391775131,-2673.79689216614,n.d.,n.d.,176470.594882965,n.d.,3961230.09574413,727272.754669189,132352.946162224,1094919.82734203,152406.42285347,0,308823.541045189,1272727.32067108,483957.237482071,n.d.,n.d.,n.d.,n.d.,n.d.,n.d.,n.d.,n.d.,n.d.,n.d.,n.d.,n.d.,n.d.,n.d.,n.d.,n.d.,n.d.,n.d.,n.d.,n.d.,n.d.,n.d.,n.d.,n.d.,n.d.,n.d.,n.d.,n.d.,n.d.,n.d.,n.d.,n.d.,24.656,14.066,5.232,16.521,11.126,3.506,4.27,37.386,7.846,5.7,5.007,8.172,n.d.,2.087,2.307,7.69,59.61,67.256,n.d.,0,1.706,1.32,0.566,21.222,26.939,201.877,21.3219713914368,499.388716673002,11.79,58.8789474051436,86.4784537924143,54.3331464317636,407.498595564431
