156,157,B&C SPEAKERS S.P.A.,No,Sì,No,No,No,IT,2640,C1,2023,104443.541872978,n.d.,"VIA POGGIOMORO, VALLINA 1",50012.0,BAGNO A RIPOLI,Italia,IT,IT,IT,Toscana,,Western Europe,"The main activity of the Company is related to the manufacture of audio equipment. The Company is active in the design, production, distribution and marketing of professional loudspeakers under the B&C brand name. Additionally, it supplies original equipment manufacturer (OEM) components to professional audio brands.","La Società è stata creata nel 1946 in Italia. L'attività principale della Società è la progettazione, produzione, distribuzione e commercializzazione di apparecchiature audio. Oltre a progettare e distribuire componenti con il marchio B&C, forniamo anche componenti di primo equipaggiamento (produttore OEM) per marchi audio professionali. La sua linea principale è composta da conduttori HF e trombe, componenti coassiali e conduttori conici. L'azienda offre anche una linea di conduttori a bassa frequenza con una gamma da sei a 21 pollici. La Società è quotata alle Borse di Milano.",Italian,"High frequency drivers, loudspeakers, and horns for the audio marketplace [source: Bureau van Dijk]","The Company was created in 1946 in Italy. The Company's main activity is the design, production, distribution and marketing of audio equipment. In addition to designing and distributing components under the B & C brand, we also supply original equipment (OEM manufacurer) components for professional audio brands. Its main line is made up of HF conductors and horns, coaxial components, and cone conductors. The Company also offers a line of low frequency conductors with a range of six to 21 inches. The Company is listed on the Milan Stock Exchanges.",IT01398890481,IT01398890481IC,5269356,FI0267229,CCIAA number,Numero iscrizione al registro delle imprese,FI0267229,1398890481.0,IT01398890481,,,1398890481.0,81560073B19D33D7DD18,,81560073B19D33D7DD18,,,,30392EI,WVB number,BEC,IT0001268561,,2024-06-25,World'Vest Base Inc.,,Very large company,Active,,,,,,Società per azioni,Società anonima - SA,No,1946,,,Azienda,,,,2010-12-31,2010.0,,12,Unqualified,Original,IFRS,AR,thousands,EUR,1.33689844608307,31540.1081399918,5593.58309841156,3497.32633495331,4268.71673834324,23901.0704190731,14219.2518725395,2.023,17.735,39.338,35.396,59.492,100,7890.37462878227,469.251354575157,4209.89320671558,3211.23006749153,16010.6957902908,6478.60986971855,8300.80245172977,1231.28346884251,669.786121487617,23901.0704190731,14219.2518725395,1371.65780568123,12847.5940668583,1768.7166441679,330.213916182518,1438.50272798538,1415.77545440197,7913.10190236568,1319.51876628399,4961.23013341427,1632.35300266743,23901.0704190731,9818.18218803406,8097.59388792515,56568.1779525423,100,31540.1081399918,31267.3808569908,15568.1824046373,15971.9257353544,10405.0806058645,5566.8451294899,26.7379689216614,28.0748673677444,1.33689844608307,5593.58309841156,2096.25676345825,3497.32633495331,0,n.d.,n.d.,3497.32633495331,n.d.,13991.9791367054,6725.93608224392,771.390403389931,2907.75412023067,65.5080238580704,0,4268.71673834324,13156.4176079035,6338.23553287983,n.d.,n.d.,n.d.,n.d.,n.d.,n.d.,n.d.,n.d.,n.d.,n.d.,n.d.,n.d.,n.d.,n.d.,n.d.,n.d.,n.d.,n.d.,n.d.,n.d.,n.d.,n.d.,n.d.,n.d.,n.d.,n.d.,n.d.,n.d.,n.d.,n.d.,n.d.,n.d.,39.338,35.396,23.403,24.596,22.284,14.633,17.735,50.64,20.096,17.65,13.534,8.925,n.d.,1.973,84.98,4.868,94.746,56.628,n.d.,0,2.023,1.205,8.039,59.492,n.s.,21.719,55.9358309841156,315.401081399918,21.325,67.2593608224392,142.192518725395,98.1818218803406,239.010704190731
157,158,RELATECH S.P.A.,No,Sì,No,No,No,IT,8411,C1,2023,103598.216493607,687,VIA ERCOLE MARELLI 165,20099.0,MILAN,Italia,IT,IT,IT,,,Western Europe,"The main activity of the Company is to design, implement and manage SAP IT solutions for the management of business processes and the enabling technology platform.","La Società è stata creata il 26 settembre 2001. La principale attività della Società è quella di progettare, implementare e gestire soluzioni IT SAP per la gestione dei processi aziendali e la piattaforma tecnologica abilitante. Offre un portafoglio di soluzioni software integrate che garantiscono la gestione IT intersettoriale in tutta l'azienda e processi aziendali totalmente sicuri, oltre a fornire servizi di consulenza SAP. La Società è quotata alla Borsa Italiana.",Italian,"Offers innovative solutions, projects and services in digital customer experience, big data, artificial intelligence, blockchain and IoT field through its digital platform replatform [source: Bureau van Dijk]","The Company was created on September 26, 2001. The main activity of the Company is to design, implement and manage SAP IT solutions for the management of business processes and the enabling technology platform. It offers a portfolio of integrated software solutions that ensure cross-sectoral IT management throughout the company and totally secure business processes, it also provides SAP consulting services. The Company is listed on the Italian Stock Exchange.",IT03267710964,IT03267710964IC,12227281,MI1662226,CCIAA number,Numero iscrizione al registro delle imprese,MI1662226,3267710964.0,IT03267710964,,,3267710964.0,815600F548FF0FE21A18,,815600F548FF0FE21A18,,,,31258EI,WVB number,RLT,IT0005371874,,2024-07-11,World'Vest Base Inc.,,Very large company,Active,,2019-07-22,,,,Società per azioni,Società anonima - SA,No,2001,,,Azienda,,,,,,,n.d.,,,,,,EUR,n.d.,n.d.,n.d.,n.d.,n.d.,n.d.,n.d.,n.d.,n.d.,n.d.,n.d.,n.d.,n.d.,n.d.,n.d.,n.d.,n.d.,n.d.,n.d.,n.d.,n.d.,n.d.,n.d.,n.d.,n.d.,n.d.,n.d.,n.d.,n.d.,n.d.,n.d.,n.d.,n.d.,n.d.,n.d.,n.d.,n.d.,n.d.,n.d.,n.d.,n.d.,n.d.,n.d.,n.d.,n.d.,n.d.,n.d.,n.d.,n.d.,n.d.,n.d.,n.d.,n.d.,n.d.,n.d.,n.d.,n.d.,n.d.,n.d.,n.d.,n.d.,n.d.,n.d.,n.d.,n.d.,n.d.,n.d.,n.d.,n.d.,n.d.,n.d.,n.d.,n.d.,n.d.,n.d.,n.d.,n.d.,n.d.,n.d.,n.d.,n.d.,n.d.,n.d.,n.d.,n.d.,n.d.,n.d.,n.d.,n.d.,n.d.,n.d.,n.d.,n.d.,n.d.,n.d.,n.d.,n.d.,n.d.,n.d.,n.d.,n.d.,n.d.,n.d.,n.d.,n.d.,n.d.,n.d.,n.d.,n.d.,n.d.,n.d.,n.d.,n.d.,n.d.,n.d.,n.d.,n.d.,n.d.,n.d.,n.d.,n.d.,n.d.,n.d.,n.d.,n.d.,n.d.,n.d.,n.d.,n.d.,n.d.
158,159,UNIDATA S.P.A,No,Sì,No,No,No,IT,2599,C1,2023,103063.396253586,204,COMMERCITY M25 - M26,148.0,ROMA,Italia,IT,IT,IT,Lazio,,Western Europe,"The Company main activity is the construction and distribution of the first microcomputers, PCs and servers","La Società è stata costituita nel 1985 in Italia. L'attività principale della Società è la costruzione e distribuzione dei primi microcomputer, PC e server. La Società è quotata alla Borsa Italiana.",Italian,"Offering the first PCs, servers and networks intensively using microprocessors and competitive development of x86 server platforms, over time it increasingly approached networks, local and geographic and since 1994 it began activity in the Internet sector as one of the first ISPs in Italy and progressively nearly all its activity became concentrated in telecommunications and System Integration [source: Bureau van Dijk]","The Company was created in 1985 in Italy. The Company main activity is the construction and distribution of the first microcomputers, PCs and servers. The Company is listed on the Italian Stock Exchange.",IT06187081002,IT06187081002IC,12820932,RM0956645,CCIAA number,Numero iscrizione al registro delle imprese,RM0956645,6187081002.0,IT06187081002,,,6187081002.0,81560042E27150979C13,,81560042E27150979C13,,,,31287EI,WVB number,UD,IT0005338840,,2024-06-04,World'Vest Base Inc.,,Very large company,Active,,,,,,Società per azioni,Società anonima - SA,No,1985,,,Azienda,,,,,,,n.d.,,,,,,EUR,n.d.,n.d.,n.d.,n.d.,n.d.,n.d.,n.d.,n.d.,n.d.,n.d.,n.d.,n.d.,n.d.,n.d.,n.d.,n.d.,n.d.,n.d.,n.d.,n.d.,n.d.,n.d.,n.d.,n.d.,n.d.,n.d.,n.d.,n.d.,n.d.,n.d.,n.d.,n.d.,n.d.,n.d.,n.d.,n.d.,n.d.,n.d.,n.d.,n.d.,n.d.,n.d.,n.d.,n.d.,n.d.,n.d.,n.d.,n.d.,n.d.,n.d.,n.d.,n.d.,n.d.,n.d.,n.d.,n.d.,n.d.,n.d.,n.d.,n.d.,n.d.,n.d.,n.d.,n.d.,n.d.,n.d.,n.d.,n.d.,n.d.,n.d.,n.d.,n.d.,n.d.,n.d.,n.d.,n.d.,n.d.,n.d.,n.d.,n.d.,n.d.,n.d.,n.d.,n.d.,n.d.,n.d.,n.d.,n.d.,n.d.,n.d.,n.d.,n.d.,n.d.,n.d.,n.d.,n.d.,n.d.,n.d.,n.d.,n.d.,n.d.,n.d.,n.d.,n.d.,n.d.,n.d.,n.d.,n.d.,n.d.,n.d.,n.d.,n.d.,n.d.,n.d.,n.d.,n.d.,n.d.,n.d.,n.d.,n.d.,n.d.,n.d.,n.d.,n.d.,n.d.,n.d.,n.d.,n.d.,n.d.,n.d.
159,160,CSP INTERNATIONAL FASHION GROUP S.P.A.,No,Sì,No,No,No,IT,1431,C1,2023,102656.756071091,546,VIA PIUBEGA 5C,46040.0,CERESARA,Italia,IT,IT,IT,Lombardia,,Western Europe,"The Company is primarily engaged in the apparel sector, active in the production and trade of hosiery, lingerie, swimwear, body wear and sports socks.","La Società è stata creata nel 1973 in Italia. L'attività principale dell'azienda è quella di operare nel settore calzetteria, producendo calze e intimo. La Società è il secondo produttore di medie per ricavi in Italia e il terzo in Europa. La Società è quotata sulla Borsa valori italiana.",Italian,Women's hosiery and lingerie; underwear collections; swimwear collections and sport socks [source: Bureau van Dijk],"The Company was created in 1973 in Italy. The Company's main activity is to operate in the hosiery sector, it produces socks and underwear. The Company is the second largest manufacturer of averages for revenues in Italy and the third largest in Europe. The Company is listed on the Italian Stock Exchange.",IT00226290203,IT00226290203IC,5303139,MN0124591,CCIAA number,Numero iscrizione al registro delle imprese,MN0124591,226290203.0,IT00226290203,,,226290203.0,81560034A79061E91A61,,81560034A79061E91A61,,,,30098EI,WVB number,CSP,IT0001127874,,2024-06-19,World'Vest Base Inc.,,Very large company,Active,,,,,,Società per azioni,Società anonima - SA,No,1973,,,Azienda,,,,2010-12-31,2010.0,,12,Unqualified,Original,IFRS,AR,thousands,EUR,1.33689844608307,143462.572249174,10528.0752629042,7927.8077852726,10429.144777894,183617.653975725,79405.0832051039,2.106,7.339,13.259,8.767,43.245,910,62806.1520985365,22621.6586061716,28973.2631235123,11211.2303688526,120811.501877189,51104.2799999714,42272.7288651466,27434.4930120707,24750.0009323359,183617.653975725,79405.0832051039,23121.6586250067,56283.4245800972,46839.5739569664,31296.7926228046,15542.7813341618,10433.1554732323,57372.9968136549,4088.23544812202,39627.0068403482,13657.7545251846,183617.653975725,53750.0020247698,63438.5050635338,67848.6657035142,910,143462.572249174,142268.721936822,76977.275627017,66485.2966221571,57727.2749018669,8758.02172029018,1770.05354261398,2310.16051483154,540.10697221756,10528.0752629042,2600.26747763157,7927.8077852726,n.d.,n.d.,n.d.,7927.8077852726,n.d.,n.d.,16887.7011709213,2501.33699262142,38338.2367383242,540.10697221756,0,10429.144777894,30457.2203986645,11259.3587129116,n.d.,n.d.,n.d.,n.d.,n.d.,n.d.,n.d.,n.d.,n.d.,n.d.,n.d.,n.d.,n.d.,n.d.,n.d.,n.d.,n.d.,n.d.,n.d.,n.d.,n.d.,n.d.,n.d.,n.d.,n.d.,n.d.,n.d.,n.d.,n.d.,n.d.,n.d.,n.d.,13.259,8.767,5.734,9.984,6.708,4.318,7.339,46.343,7.848,6.105,7.27,6.026,n.d.,1.136,16.215,2.807,106.078,99.439,n.d.,0,2.106,1.215,1.695,43.245,76.195,64.137,11.5693132700422,157.651178398634,11.772,18.5579138006834,87.2583335009369,59.0659367170004,201.77764129083
160,161,GROWENS S.P.A,No,Sì,No,No,No,IT,6201,C1,2023,101999.280776024,147,VIALE FRANCESCO RESTELLI 1,20124.0,MILANO,Italia,IT,IT,IT,,,Western Europe,The main activities of the Company is a technological Italian company that has developed a digital cloud computing platform (Software as a Service - SaaS) used by SMEs and large enterprises.,"La Società è stata fondata il 23 settembre 2002 in Italia. L'attività principale della Società è lo sviluppo di una piattaforma di cloud computing digitale (Software as a Service - SaaS) utilizzata da PMI e grandi aziende. La Società è quotata alla Borsa Italiana.



Storia
La capogruppo
 MailUp S.p.A. cambia denominazione in ""Growens S.p.A."", assumendo la decisione entro un progetto più ampio, con l'obiettivo di aggiornare il posizionamento aziendale, la mission e lo scopo per meglio identificare un Gruppo internazionale, che si compone di cinque business unit e un portafoglio di soluzioni per applicazioni di marketing.",Italian,"Marketing technology on the cloud; MailUp, a digital cloud computing platform for small and medium-sized, and large enterprises to create, send, and monitor newsletters, e-mails, text messages, and social networks [source: Bureau van Dijk]","The Company was founded on September 23, 2002 in Italy. The Company's main activity is the development of a digital cloud computing platform (Software as a Service - SaaS) used by SMEs and large companies. The Company is listed on the Italian Stock Exchange.

History

The parent company MailUp S.p.A. changes its name to ""Growens S.p.A."", by making the decision within a
Broader project, with the objective of updating the corporate positioning, mission and purpose to better identify an international Group, which consists of five business units and a portfolio of solutions for marketing applications.",IT01279550196,IT01279550196IC,12806226,MI1743733,CCIAA number,Numero iscrizione al registro delle imprese,MI1743733,1279550196.0,IT01279550196,,,1279550196.0,81560064C025D37F4645,,81560064C025D37F4645,,,,30490EI,WVB number,GROW,IT0005040354,,2024-07-08,World'Vest Base Inc.,,Very large company,Active,,2014-09-26,,,,Società per azioni,Società anonima - SA,No,2002,,,Azienda,,,,,,,n.d.,,,,,,EUR,n.d.,n.d.,n.d.,n.d.,n.d.,n.d.,n.d.,n.d.,n.d.,n.d.,n.d.,n.d.,n.d.,n.d.,n.d.,n.d.,n.d.,n.d.,n.d.,n.d.,n.d.,n.d.,n.d.,n.d.,n.d.,n.d.,n.d.,n.d.,n.d.,n.d.,n.d.,n.d.,n.d.,n.d.,n.d.,n.d.,n.d.,n.d.,n.d.,n.d.,n.d.,n.d.,n.d.,n.d.,n.d.,n.d.,n.d.,n.d.,n.d.,n.d.,n.d.,n.d.,n.d.,n.d.,n.d.,n.d.,n.d.,n.d.,n.d.,n.d.,n.d.,n.d.,n.d.,n.d.,n.d.,n.d.,n.d.,n.d.,n.d.,n.d.,n.d.,n.d.,n.d.,n.d.,n.d.,n.d.,n.d.,n.d.,n.d.,n.d.,n.d.,n.d.,n.d.,n.d.,n.d.,n.d.,n.d.,n.d.,n.d.,n.d.,n.d.,n.d.,n.d.,n.d.,n.d.,n.d.,n.d.,n.d.,n.d.,n.d.,n.d.,n.d.,n.d.,n.d.,n.d.,n.d.,n.d.,n.d.,n.d.,n.d.,n.d.,n.d.,n.d.,n.d.,n.d.,n.d.,n.d.,n.d.,n.d.,n.d.,n.d.,n.d.,n.d.,n.d.,n.d.,n.d.,n.d.,n.d.,n.d.,n.d.
161,162,GIBUS S.P.A.,No,Sì,No,No,No,IT,1399,C1,2023,101732.975656509,417,VIA L. ENAUDI 35,35030.0,SACCOLONGO,Italia,IT,IT,IT,Veneto,,Western Europe,"The Company main activity is the manufacture of textile products. The company offers several types of curtains, such as awnings, awnings, screen locks, closures and other related items.","La Società è stata creata il 26 luglio 2011. L'attività principale dell'azienda è la produzione di prodotti tessili. L'azienda offre diversi tipi di tende, come tende da sole, tende da sole, serrature per schermi, chiusure e altri articoli correlati. La Società è quotata alla Borsa Italiana.",Italian,Clothing apparels [source: Bureau van Dijk],"The Company was founded on July 26, 2011 in Italy. The Company main activity is the manufacture of textile products. The company offers several types of curtains, such as awnings, awnings, screen locks, closures and other related items. The Company is listed on the Italian Stock Exchange.",IT04584110284,IT04584110284IC,134584179,PD0401653,CCIAA number,Numero iscrizione al registro delle imprese,PD0401653,4584110284.0,IT04584110284,,,4584110284.0,8156006E5A548D01E653,,8156006E5A548D01E653,,,,31257EI,WVB number,GIBUS,IT0005341059,,2024-06-06,World'Vest Base Inc.,,Very large company,Active,,2019-07-10,,,,Società per azioni,Società anonima - SA,No,2011,,,Azienda,,,,,,,n.d.,,,,,,EUR,n.d.,n.d.,n.d.,n.d.,n.d.,n.d.,n.d.,n.d.,n.d.,n.d.,n.d.,n.d.,n.d.,n.d.,n.d.,n.d.,n.d.,n.d.,n.d.,n.d.,n.d.,n.d.,n.d.,n.d.,n.d.,n.d.,n.d.,n.d.,n.d.,n.d.,n.d.,n.d.,n.d.,n.d.,n.d.,n.d.,n.d.,n.d.,n.d.,n.d.,n.d.,n.d.,n.d.,n.d.,n.d.,n.d.,n.d.,n.d.,n.d.,n.d.,n.d.,n.d.,n.d.,n.d.,n.d.,n.d.,n.d.,n.d.,n.d.,n.d.,n.d.,n.d.,n.d.,n.d.,n.d.,n.d.,n.d.,n.d.,n.d.,n.d.,n.d.,n.d.,n.d.,n.d.,n.d.,n.d.,n.d.,n.d.,n.d.,n.d.,n.d.,n.d.,n.d.,n.d.,n.d.,n.d.,n.d.,n.d.,n.d.,n.d.,n.d.,n.d.,n.d.,n.d.,n.d.,n.d.,n.d.,n.d.,n.d.,n.d.,n.d.,n.d.,n.d.,n.d.,n.d.,n.d.,n.d.,n.d.,n.d.,n.d.,n.d.,n.d.,n.d.,n.d.,n.d.,n.d.,n.d.,n.d.,n.d.,n.d.,n.d.,n.d.,n.d.,n.d.,n.d.,n.d.,n.d.,n.d.,n.d.,n.d.
162,163,CLASS EDITORI SPA,No,Sì,No,No,No,IT,1811,C1,2023,97979.2889719009,359,VIA BURIGOZZO 5,20122.0,MILANO,Italia,IT,IT,IT,Lombardia,,Western Europe,"The main activities of The Company to the publishing sector, the Company structures its business in five main areas: newspapers, magazines, electronic publications, professional services and television and radio channels","La Società è stata creata in 1986 in Italia. La Società ha come core business il settore dell'editoria, la società struttura la sua attività in cinque aree principali: giornali, riviste, pubblicazioni elettroniche, servizi professionali e canali televisivi e radiofonici. La Società è quotata alla Borsa Italiana.",Italian,"Digital satellite television channel, Class CNBC, (formerly Cfn/Cnbc) in partnership with NBC-Vivendi Universal, Dow Jones, General Electric and Mediaset, the digital terrestrial television channel, Class News, the new all-news channel carried by Mediaset's multiplex, and Class Life, the first television channel dedicated to life's pleasures [source: Bureau van Dijk]","The Company was created in 1986 in Italy. The main activities of The Company to the publishing sector, the Company structures its business in five main areas: newspapers, magazines, electronic publications, professional services and television and radio channels. The Company is listed on the Italian Stock Exchange Borsa Italiana.",IT08114020152,IT08114020152IC,5292319,MI1205471,CCIAA number,Numero iscrizione al registro delle imprese,MI1205471,8114020152.0,IT08114020152,,,8114020152.0,81560022EE962F731A95,,81560022EE962F731A95,,,,30151EI,WVB number,CLE,IT0005117848,,2024-04-26,World'Vest Base Inc.,,Very large company,Active,,,,,,Società per azioni,Società anonima - SA,No,1986,,,Azienda,,,,2010-12-31,2010.0,,12,Unqualified,Original,IFRS,AR,thousands,EUR,1.33689844608307,170647.065251827,-3907.75415790081,-2509.35838329792,9296.79179406166,293915.786472917,93124.3350588083,0.988,-2.29,-4.196,-2.14,31.684,471,118155.084664822,98975.9395573139,9093.58323025703,10085.5618772507,175760.701808095,5352.94137811661,80407.7570396662,90000.0033903122,17977.273404479,293915.786472917,93124.3350588083,13926.4711128473,79197.863945961,22877.0062093735,2033.42253649235,20843.5836728811,8207.21956050396,177914.445204735,74562.837033391,36608.2901490927,66743.3180222511,293915.786472917,49152.4082686901,-2153.74339663982,127782.35454227,471,170647.065251827,155431.824036956,79899.7356301546,90747.3296216726,92474.602414012,-1727.27279233932,-2180.48136556149,471.925151467323,2652.40651702881,-3907.75415790081,-1586.8984555006,-2320.85570240021,-188.502680897713,n.d.,n.d.,-2509.35838329792,n.d.,9064.17146444321,34868.9852707386,11806.1501773596,45799.4669659138,1425.13374352455,0,9296.79179406166,44004.0123528242,10078.8773850203,n.d.,n.d.,n.d.,n.d.,n.d.,n.d.,n.d.,n.d.,n.d.,n.d.,n.d.,n.d.,n.d.,n.d.,n.d.,n.d.,n.d.,n.d.,n.d.,n.d.,n.d.,n.d.,n.d.,n.d.,n.d.,n.d.,n.d.,n.d.,n.d.,n.d.,n.d.,n.d.,-4.196,-2.14,-1.33,-2.695,-0.935,-0.854,-2.29,53.178,5.906,-1.012,5.448,12.678,n.d.,1.471,-1.212,31.879,169.63,77.229,n.d.,0,0.988,0.958,4.071,31.684,46.379,104.634,-8.29671822697699,362.307993594715,20.433,74.031815623013,197.716210656552,104.357554733302,624.025024844005
163,164,PININFARINA SPA,No,Sì,No,No,No,IT,2910,C1,2023,97192.5286188126,467,VIA BRUNO BUOZZI 6,10100.0,TORINO,Italia,IT,IT,IT,,,Western Europe,The main activity of the Company is related to the establishment of partnerships with complete automobile manufacturers.,"La Società è stata creata nel 1930 in Italia. L'attività principale della Società è legata alla costituzione di partnership con complete case automobilistiche. Operare come partner globale ti consente di lavorare con i clienti durante l'intero processo di sviluppo del nuovo prodotto, inclusi design, pianificazione, sviluppo, industrializzazione e produzione, o fornire supporto separato durante una di queste fasi per la massima flessibilità. La Società è quotata alla Borsa Italiana.",Italian,"Specialises in the provision of design, product, and process engineering services; and manufacture of motor vehicles. The company is considered one of the leading service company in the automotive industry. It aims to offer OEMs (original equipment Manufacturers) creative solutions based on know-how and flexibility through each stage in the concept and design, product and process engineering, and niche manufacturing. [source: Bureau van Dijk]","The Company was created in 1930 in Italy. The main activity of the Company is related to the establishment of partnerships with complete automobile manufacturers. Operating as a global partner enables you to work with customers through the entire new product development process, including design, planning, development, industrialization and manufacturing, or provide separate support during any of these phases to the maximum flexibility. The Company is listed on the Italian Stock Exchange.",IT00489110015,IT00489110015IC,5351711,TO0107739,CCIAA number,Numero iscrizione al registro delle imprese,TO0107739,489110015.0,IT00489110015,,,489110015.0,815600EB5D56D95BA637,,815600EB5D56D95BA637,,,,20065EI,WVB number,PINF,IT0003056386,,2024-06-22,World'Vest Base Inc.,,Very large company,Active,,,,,,Società per azioni,Società anonima - SA,No,1930,,,Azienda,,,,2010-12-31,2010.0,,12,Unqualified,Original,IFRS,AR,thousands,EUR,1.33689844608307,275086.908758283,-43070.8572374582,-44219.2530026436,-27335.5625270605,429782.101751447,28080.2149615288,1.971,-15.657,-153.385,-8.639,6.534,830,172005.354073048,4135.02689373493,97847.5972688198,70022.7299104929,257776.747678399,1895.72199654579,24330.2148202658,231550.810861588,154098.936286211,429782.101751447,28080.2149615288,40308.8250478506,-12228.6100863218,270938.512880087,258739.314559579,12199.198320508,12196.5245236158,130763.373909831,65557.4891005754,44121.6594160795,21084.2253931761,429782.101751447,-17895.722599268,127013.373768568,315815.604865031,830,275086.908758283,273271.400668502,172041.450331092,103045.458427191,131911.769675016,-28866.3112478256,-14204.5459896326,771.390403389931,14975.9363930225,-43070.8572374582,1148.39576518536,-44219.2530026436,n.d.,n.d.,n.d.,-44219.2530026436,n.d.,167562.840536714,63442.515758872,16883.6904755831,51585.5634405613,17239.3054622412,0,-27335.5625270605,54494.6544592381,-11982.6207722425,n.d.,n.d.,n.d.,n.d.,n.d.,n.d.,n.d.,n.d.,n.d.,n.d.,n.d.,n.d.,n.d.,n.d.,n.d.,n.d.,n.d.,n.d.,n.d.,n.d.,n.d.,n.d.,n.d.,n.d.,n.d.,n.d.,n.d.,n.d.,n.d.,n.d.,n.d.,n.d.,-153.385,-8.639,-10.022,-157.475,-9.023,-10.289,-15.657,37.459,-4.356,-10.494,-9.937,n.s.,n.d.,0.92,-1.674,145.109,31.84,57.741,n.d.,0,1.971,1.957,0.104,6.534,6.99,n.s.,-51.8925995483841,331.430011148115,23.063,76.4367662483672,33.8315841621408,-21.5611117747768,517.809761484573
