73,74,EMAK S.P.A.,No,Sì,No,No,No,IT,2830,C1,2023,631595.07845211,428,VIA E.FERMI 4,42011.0,BAGNOLO IN PIANO,Italia,IT,IT,IT,Emilia-Romagna,,Western Europe,"The main activities of the Company is related to produce and distribute machines for gardening, forestry and lawn care.","La Società è stata creata nel 1992, in Italia. L'attività principale della Società è quello di produrre e distribuire macchine per il giardinaggio, forestale e la cura del prato. La Società è quotata alla Borsa Italiana (MTA).",Italian,"Manufacture and distribution of machines, components and accessories for gardening, agriculture, forestry and industrial applications [source: Bureau van Dijk]","The Company was created in 1992, in Italy. The main activity of the Company is to produce and distribute machines for gardening, forestry and lawn care. The Company is listed on the Italian Stock Exchange (MTA).",IT00130010358,IT00130010358IC,5330917,RE0107563,CCIAA number,Numero iscrizione al registro delle imprese,RE0107563,130010358.0,IT00130010358,,,130010358.0,815600A9C09D82FF2B66,,815600A9C09D82FF2B66,,,,30184EI,WVB number,EM,IT0001237053,,2024-05-28,World'Vest Base Inc.,,Very large company,Active,,,,,,Società per azioni,Società anonima - SA,No,1992,,,Azienda,,,,2010-12-31,2010.0,,12,Unqualified,Original,IFRS,AR,thousands,EUR,1.33689844608307,281483.96782279,22136.3644702435,15467.9150211811,25331.551756382,276728.620050073,152446.529806852,2.325,7.864,14.521,12.432,55.089,407,91205.8857886791,18631.0167446136,66870.323374629,5704.54566943645,185522.734261394,94471.9286924601,72228.61234653,18822.1932224035,10665.7758028507,276728.620050073,152446.529806852,6899.73288023472,145546.796926618,44500.001676321,30402.4075623751,14097.594113946,7465.24092292786,79782.0885668993,16887.7011709213,51509.3602291346,11385.0271668434,276728.620050073,115191.180809855,105740.645694494,199469.65790755,407,281483.96782279,276450.545173287,175610.969182134,105872.998640656,83557.4897786379,22315.5088620186,-179.144391775131,715.240668654442,894.385060429573,22136.3644702435,6602.94142520428,15533.4230450392,-65.5080238580704,n.d.,n.d.,15467.9150211811,n.d.,157655.086152792,43405.081848979,9863.63673520088,24066.8458263874,2347.59367132187,6221.9253680706,25331.551756382,77687.1687018871,32179.1455972195,n.d.,n.d.,n.d.,n.d.,n.d.,n.d.,n.d.,n.d.,n.d.,n.d.,n.d.,n.d.,n.d.,n.d.,n.d.,n.d.,n.d.,n.d.,n.d.,n.d.,n.d.,n.d.,n.d.,n.d.,n.d.,n.d.,n.d.,n.d.,n.d.,n.d.,n.d.,n.d.,14.521,12.432,7.999,10.146,9.046,5.59,7.864,37.612,11.432,7.928,8.999,6.199,n.d.,1.429,9.506,2.98,92.376,65.877,n.d.,2.21,2.325,1.141,3.426,55.089,n.s.,40.268,54.3891023162245,691.606800117092,15.42,106.646393054817,374.561498067001,283.025014672285,679.922899944338
74,75,PIOVAN S.P.A.,No,Sì,No,No,No,IT,2829,C1,2023,630425.987927437,1805,VIA DELLE INDUSTRIE 16,30036.0,SANTA MARIA DI SALA,Italia,IT,IT,IT,Veneto,,Western Europe,"The main activity of the Company is related to automation systems for the storage, transportation and processing of plastic materials and powdered food.","La società è nata nel 1934 in Italia. L'attività principale della Società sono i sistemi di automazione per lo stoccaggio, il trasporto e la lavorazione di materie plastiche e alimenti in polvere. La Società è quotata alla Borsa Italiana.",Italian,Equipment for plastic materials processing [source: Bureau van Dijk],"The Company was created in 1934 in Italy. The main activity of the Company is related to automation systems for the storage, transportation and processing of plastic materials and powdered food. The Company is listed on the Borsa Italiana.",IT02307730289,IT02307730289IC,5367712,VE0235320,CCIAA number,Numero iscrizione al registro delle imprese,VE0235320,2307730289.0,IT02700490275,,,2307730289.0,8156007367A2044B7685,,8156007367A2044B7685,,,,31235EI,WVB number,PVN,IT0005337958,,2024-04-29,World'Vest Base Inc.,,Very large company,Active,,2018-11-08,,,,Società per azioni,Società anonima - SA,No,1934,,,Azienda,,,,,,,n.d.,,,,,,EUR,n.d.,n.d.,n.d.,n.d.,n.d.,n.d.,n.d.,n.d.,n.d.,n.d.,n.d.,n.d.,n.d.,n.d.,n.d.,n.d.,n.d.,n.d.,n.d.,n.d.,n.d.,n.d.,n.d.,n.d.,n.d.,n.d.,n.d.,n.d.,n.d.,n.d.,n.d.,n.d.,n.d.,n.d.,n.d.,n.d.,n.d.,n.d.,n.d.,n.d.,n.d.,n.d.,n.d.,n.d.,n.d.,n.d.,n.d.,n.d.,n.d.,n.d.,n.d.,n.d.,n.d.,n.d.,n.d.,n.d.,n.d.,n.d.,n.d.,n.d.,n.d.,n.d.,n.d.,n.d.,n.d.,n.d.,n.d.,n.d.,n.d.,n.d.,n.d.,n.d.,n.d.,n.d.,n.d.,n.d.,n.d.,n.d.,n.d.,n.d.,n.d.,n.d.,n.d.,n.d.,n.d.,n.d.,n.d.,n.d.,n.d.,n.d.,n.d.,n.d.,n.d.,n.d.,n.d.,n.d.,n.d.,n.d.,n.d.,n.d.,n.d.,n.d.,n.d.,n.d.,n.d.,n.d.,n.d.,n.d.,n.d.,n.d.,n.d.,n.d.,n.d.,n.d.,n.d.,n.d.,n.d.,n.d.,n.d.,n.d.,n.d.,n.d.,n.d.,n.d.,n.d.,n.d.,n.d.,n.d.,n.d.,n.d.
75,76,DATALOGIC S.P.A.,No,Sì,No,No,No,IT,2620,C1,2023,597853.888309479,2910,VIA CANDINI 2,40012.0,CALDERARA DI RENO,Italia,IT,IT,IT,Emilia-Romagna,,Western Europe,"The main activity of the Company is related to production of technology equipment. Its activities are divided into five business segments. The automated Sata capture segment encompasses manual reader product lines, stationary readers, mobile computers, automated scanning solutions, management technologies, field force and sales automation, and in-store data collection.","La Società nasce nel 1972, in Italia. L'attività principale della Società è la produzione di apparecchiature tecnologiche. Le sue attività sono suddivise in cinque segmenti di business. Il segmento di acquisizione Sata automatizzata comprende linee di prodotti di lettori manuali, lettori fissi, computer portatili, soluzioni di scansione automatizzata, tecnologie di gestione, personale sul campo e automazione delle vendite e raccolta dati in negozio. La Società è quotata alla Borsa Italiana.",Italian,"Bar code readers, portable data collection terminals, and Radio Frequency Identification Device (RFID) systems [source: Bureau van Dijk]","The Company was founded in 1972, in Italy. The main activity of the Company is related to production of technology equipment. Its activities are divided into five business segments. The automated Sata capture segment encompasses manual reader product lines, stationary readers, mobile computers, automated scanning solutions, management technologies, field force and sales automation, and in-store data collection. The Company is listed on the Italian Stock Exchange.",IT01835711209,IT01835711209IC,5252023,BO0391717,CCIAA number,Numero iscrizione al registro delle imprese,BO0391717,1835711209.0,IT01835711209,,,1835711209.0,815600A033443037ED66,,0001566616,,,,30178EI,WVB number,DAL,IT0004053440,,2024-04-24,World'Vest Base Inc.,,Very large company,Active,,,,,,Società per azioni,Società anonima - SA,No,1972,,,Azienda,,,,2010-12-31,2010.0,,12,Unqualified,Original,IFRS,AR,thousands,EUR,1.33689844608307,527919.805983067,37676.472007513,24101.6051859856,45363.6380724907,612657.777089596,187385.033796787,1.541,7.137,20.106,11.65,30.586,2019,299279.423038602,196639.044840574,66901.0720388889,35739.3061591387,313378.354050994,60572.1947951317,89012.0354386568,163794.123817205,137250.005170226,612657.777089596,187385.033796787,40631.0175733566,146754.016223431,221925.142049789,174046.798000216,47878.3440495729,22652.4072704315,203347.601243019,63895.7243320942,75263.3718191385,64188.5050917864,612657.777089596,74320.85841465,110030.752807975,570119.809909385,2019,527919.805983067,525056.169511557,245782.094820142,282137.711162925,235771.399255872,46366.311907053,-8689.83989953995,1005.34763145447,9695.18753099442,37676.472007513,13574.8668215275,24101.6051859856,0,n.d.,n.d.,24101.6051859856,n.d.,203144.392679214,152586.904143691,21262.0328865051,26756.6854999065,10006.6848689318,35165.776725769,45363.6380724907,221532.093906641,67628.3447935581,n.d.,n.d.,n.d.,n.d.,n.d.,n.d.,n.d.,n.d.,n.d.,n.d.,n.d.,n.d.,n.d.,n.d.,n.d.,n.d.,n.d.,n.d.,n.d.,n.d.,n.d.,n.d.,n.d.,n.d.,n.d.,n.d.,n.d.,n.d.,n.d.,n.d.,n.d.,n.d.,20.106,11.65,6.15,12.862,8.333,3.934,7.137,53.443,12.81,8.783,8.593,8.43,n.d.,1.29,4.634,8.716,60.699,51.324,n.d.,6.661,1.541,1.243,0.844,30.586,44.062,152.531,18.6609565853137,261.475881507586,28.903,75.5754854672595,92.8108136566236,36.8107273224939,303.44615046829
76,77,ZIGNAGO VETRO S.P.A.,No,Sì,No,No,No,IT,2319,C1,2023,580615.880573273,2748,VIA ITA MARZOTTO 8,30025.0,FOSSALTA DI PORTOGRUARO,Italia,IT,IT,IT,Veneto,,Western Europe,"The main activity of the Company is related to the production and commercialization of hollow glass containers for food and beverages, cosmetics, perfumery, and special glasses","L'azienda nasce nel 1950 in Italia. L'attività principale della Società è la produzione e commercializzazione di contenitori in vetro cavo per alimenti e bevande, cosmetici, profumeria e bicchieri speciali. La Società è quotata alla Borsa Italiana.",Italian,"Glass and glass products by melting silica sand or cullet and purchasing glass; Hollow glass containers for food and beverage, cosmetics, perfumery, and speciality glass containers [source: Bureau van Dijk]","The Company was founded in 1950 in Italy. The main activity of the Company is related to the production and commercialization of hollow glass containers for food and beverages, cosmetics, perfumery, and special glasses. The Company is listed on the Italian Stock Exchange.",IT00717800247,IT00717800247IC,9573634,VE0159186,CCIAA number,Numero iscrizione al registro delle imprese,VE0159186,717800247.0,IT00884050279,,,717800247.0,815600DFC29A91FF0C71,,0001560403,,,,30380EI,WVB number,ZV,IT0004171440,,2024-04-02,World'Vest Base Inc.,,Very large company,Active,,,,,,Società per azioni,Società anonima - SA,No,1950,,,Azienda,,,,2010-12-31,2010.0,,12,Unqualified,Original,IFRS,AR,thousands,EUR,1.33689844608307,357101.617730141,63712.5692449808,45160.4295086861,75193.8530999422,410639.052901983,144453.213997722,0.968,17.842,44.106,33.1,35.178,1435,206078.884768367,53685.8308993578,148816.850525737,3576.20334327221,204560.168133616,61268.718885541,76491.9814910889,66799.4677569866,61608.2910908461,410639.052901983,144453.213997722,10695.1875686646,133758.026429057,54782.0876251459,37120.3222539425,17661.7653712034,12680.4817610979,211403.751279116,125398.4004457,65478.6120922565,20526.7387411594,410639.052901983,72282.0882843733,-6843.58314549923,617566.20914477,1435,357101.617730141,354088.248632669,168985.300483346,188116.317246795,121830.218493104,66286.0987536907,-2573.52950870991,473.262049913406,3046.79155862331,63712.5692449808,18552.1397362947,45160.4295086861,n.d.,n.d.,n.d.,45160.4295086861,n.d.,86614.9765248299,73641.7140040398,30033.4235912561,18155.0808978081,2233.95730340481,0,75193.8530999422,169621.664143682,96319.5223449469,n.d.,n.d.,n.d.,n.d.,n.d.,n.d.,n.d.,n.d.,n.d.,n.d.,n.d.,n.d.,n.d.,n.d.,n.d.,n.d.,n.d.,n.d.,n.d.,n.d.,n.d.,n.d.,n.d.,n.d.,n.d.,n.d.,n.d.,n.d.,n.d.,n.d.,n.d.,n.d.,44.106,33.1,15.515,31.263,23.788,10.998,17.842,52.679,26.973,18.562,21.057,6.412,n.d.,1.792,29.672,5.828,77.113,66.01,n.d.,0,0.968,0.678,2.637,35.178,54.268,124.733,44.3990030094148,248.851302155011,20.622,51.3182679759468,100.664260476528,50.3707933413248,286.159619068441
77,78,JUVENTUS FOOTBALL CLUB S.P.A.,No,Sì,No,No,No,IT,9312,C2,2023,551615.66188097,512,CORSO GALILEO FERRARIS 32,10128.0,TORINO,Italia,IT,IT,IT,,,Western Europe,"The Company main activity is the exploitation and management of the Juventus football team and the management of teams, as well as the organization of football matches, ticket sales, sale of television and radio rights for the broadcast of matches, activities sponsorship, sale of advertising space, and other related activities.","La Società è stata fondata il 1 novembre 1897 in Italia. L'attività principale della Società è la valorizzazione e gestione della squadra di calcio Juventus e la gestione delle squadre, nonché l'organizzazione di partite di calcio, vendita di biglietti, vendita di diritti televisivi e radiofonici per la trasmissione di partite, attività di sponsorizzazione, vendita di pubblicità spazio e altre attività correlate. La Società è quotata alla Borsa di Milano.",Italian,Management of a professional football club [source: Bureau van Dijk],"The Company was founded November 1, 1897 in Italy. The Company main activity is the exploitation and management of the Juventus football team and the management of teams, as well as the organization of football matches, ticket sales, sale of television and radio rights for the broadcast of matches, activities sponsorship, sale of advertising space, and other related activities. The Company is listed on the Milan Stock Exchange.",IT00470470014,IT00470470014IC,5352240,TO0394963,CCIAA number,Numero iscrizione al registro delle imprese,TO0394963,470470014.0,IT00470470014,,,470470014.0,815600A253A0AF58C166,,815600A253A0AF58C166,,,,30282EI,WVB number,JUVE,IT0005572778,,2023-11-28,World'Vest Base Inc.,,Very large company,Active,,,,,,Società per azioni,Società anonima - SA,No,1897,,,Azienda,,,,,,,n.d.,,,,,,EUR,n.d.,n.d.,n.d.,n.d.,n.d.,n.d.,n.d.,n.d.,n.d.,n.d.,n.d.,n.d.,n.d.,n.d.,n.d.,n.d.,n.d.,n.d.,n.d.,n.d.,n.d.,n.d.,n.d.,n.d.,n.d.,n.d.,n.d.,n.d.,n.d.,n.d.,n.d.,n.d.,n.d.,n.d.,n.d.,n.d.,n.d.,n.d.,n.d.,n.d.,n.d.,n.d.,n.d.,n.d.,n.d.,n.d.,n.d.,n.d.,n.d.,n.d.,n.d.,n.d.,n.d.,n.d.,n.d.,n.d.,n.d.,n.d.,n.d.,n.d.,n.d.,n.d.,n.d.,n.d.,n.d.,n.d.,n.d.,n.d.,n.d.,n.d.,n.d.,n.d.,n.d.,n.d.,n.d.,n.d.,n.d.,n.d.,n.d.,n.d.,n.d.,n.d.,n.d.,n.d.,n.d.,n.d.,n.d.,n.d.,n.d.,n.d.,n.d.,n.d.,n.d.,n.d.,n.d.,n.d.,n.d.,n.d.,n.d.,n.d.,n.d.,n.d.,n.d.,n.d.,n.d.,n.d.,n.d.,n.d.,n.d.,n.d.,n.d.,n.d.,n.d.,n.d.,n.d.,n.d.,n.d.,n.d.,n.d.,n.d.,n.d.,n.d.,n.d.,n.d.,n.d.,n.d.,n.d.,n.d.,n.d.,n.d.
78,79,ELICA SPA,No,Sì,No,No,No,IT,2751,C1,2023,528774.782307625,2658,VIA ERMANNO CASOLI 2,60044.0,FABRIANO,Italia,IT,IT,IT,Marche,,Western Europe,"The Company's main activity is the industry of domestic extractor hoods, as well as the production and marketing of electric motors for household appliances and heating boilers.","L'a societá è stata fondata nel 1970 in Italia. L'attività principale della Società è l'industria delle cappe da cucina per uso domestico, nonché la produzione e commercializzazione di motori elettrici per elettrodomestici e caldaie per riscaldamento. La Società è quotata alla Borsa di Milano.",Italian,"Kitchen units, cookers, motors and other electronics appliances products [source: Bureau van Dijk]","The Company was created in 1970 in Italy. The Company's main activity is the industry of domestic extractor hoods, as well as the production and marketing of electric motors for household appliances and heating boilers. The Company is listed on the Milan Stock Exchange.",IT00096570429,IT00096570429IC,5236052,AN0063006,CCIAA number,Numero iscrizione al registro delle imprese,AN0063006,96570429.0,IT00096570429,,,96570429.0,815600F231566A38BC43,,815600F231566A38BC43,,,,30341EI,WVB number,ELC,IT0003404214,,2024-05-31,World'Vest Base Inc.,,Very large company,Active,,,,,,Società per azioni,Società anonima - SA,No,1970,,,Azienda,,,,2010-12-31,2010.0,,12,Unqualified,Original,IFRS,AR,thousands,EUR,1.33689844608307,495502.692462444,12004.0111473799,5697.86117720604,26608.2897723913,444006.701217771,186537.440181971,1.263,2.423,6.435,5.883,42.012,2800,217311.505512357,86946.5273394585,111871.661968231,18493.3162046671,226695.195705414,57046.7935928106,119343.587383389,50304.8147292137,33558.8247935772,444006.701217771,186537.440181971,16931.8188196421,169605.621362329,78004.0136336088,40819.5202542543,37184.4933793545,23310.1613059044,179465.247402191,39339.5736744404,118639.041902304,21486.6318254471,444006.701217771,57751.3390738964,47229.9483032227,166812.617200703,2800,495502.692462444,492332.906246781,327494.664743185,168008.027719259,148632.358540177,19375.6691790819,-7371.65803170204,1848.93055093288,9220.58858263493,12004.0111473799,4548.1285135746,7455.88263380527,-1758.02145659924,n.d.,n.d.,5697.86117720604,n.d.,258938.512428045,96787.4368010759,20910.4285951853,22013.3698132038,3560.16056191921,8921.12333071232,26608.2897723913,131504.015648961,40286.0977742672,n.d.,n.d.,n.d.,n.d.,n.d.,n.d.,n.d.,n.d.,n.d.,n.d.,n.d.,n.d.,n.d.,n.d.,n.d.,n.d.,n.d.,n.d.,n.d.,n.d.,n.d.,n.d.,n.d.,n.d.,n.d.,n.d.,n.d.,n.d.,n.d.,n.d.,n.d.,n.d.,6.435,5.883,2.704,3.055,3.5,1.283,2.423,33.907,8.13,3.91,5.37,4.141,n.d.,1.873,5.442,8.686,86.707,86.195,n.d.,1.8,1.263,0.945,2.391,42.012,72.45,62.906,4.28714722032094,176.965247308016,19.533,34.5669411417135,66.6205145416893,20.6254780496918,158.573821481519
79,80,GPI S.P.A.,No,Sì,No,No,No,IT,8621,C1,2023,495241.332258224,7638,VIA RAGAZZI DEL '99 13,38123.0,TRENTO,Italia,IT,IT,IT,Trentino-Alto Adige,,Western Europe,"The main activity of the Company is related to provide IT systems, such as health enterprise resource planning, hospital information, territorial, health and social, veterinary control management and food safety technology systems, as well as web solutions. It also provides healthcare services comprising contact center and front office solutions; sustainable territorial and comprehensive services, a technology platform for the provision of health and social care, as well as integrated care services.","L'azienda è stata fondata nel 1988, in Italia. Il core business dell'azienda è la fornitura di sistemi informatici, come la pianificazione delle risorse dell'impresa sanitaria, l'informazione ospedaliera, l'informazione territoriale, l'informazione sanitaria e sociale, la gestione del controllo veterinario e i sistemi tecnologici di sicurezza alimentare, così come le soluzioni web. Fornisce anche servizi sanitari che comprendono soluzioni di contact center e front office; servizi territoriali e globali sostenibili, una piattaforma tecnologica per la fornitura di assistenza sanitaria e sociale, nonché servizi di assistenza integrata. La Società è quotata alla Borsa Italiana.",Italian,"Software development, computer programming, data processing, and other computer related services [source: Bureau van Dijk]","The Company was founded in 1988 in Italy. The main activity of the Company is related to provide IT systems, such as health enterprise resource planning, hospital information, territorial, health and social, veterinary control management and food safety technology systems, as well as web solutions. It also provides healthcare services comprising contact center and front office solutions; sustainable territorial and comprehensive services, a technology platform for the provision of health and social care, as well as integrated care services. The Company is listed on the Italian Stock Exchange.",IT01944260221,IT01944260221IC,17666261,TN0189428,CCIAA number,Numero iscrizione al registro delle imprese,TN0189428,1944260221.0,IT01944260221,,,1944260221.0,815600320CCB55749A30,,815600320CCB55749A30,,,,31256EI,WVB number,GPI,IT0005221517,IT0004981913,2024-05-09,World'Vest Base Inc.,,Very large company,Active,,2019-06-27,,,,Società per azioni,Società anonima - SA,No,1988,,,Azienda,,,,,,,n.d.,,,,,,EUR,n.d.,n.d.,n.d.,n.d.,n.d.,n.d.,n.d.,n.d.,n.d.,n.d.,n.d.,n.d.,n.d.,n.d.,n.d.,n.d.,n.d.,n.d.,n.d.,n.d.,n.d.,n.d.,n.d.,n.d.,n.d.,n.d.,n.d.,n.d.,n.d.,n.d.,n.d.,n.d.,n.d.,n.d.,n.d.,n.d.,n.d.,n.d.,n.d.,n.d.,n.d.,n.d.,n.d.,n.d.,n.d.,n.d.,n.d.,n.d.,n.d.,n.d.,n.d.,n.d.,n.d.,n.d.,n.d.,n.d.,n.d.,n.d.,n.d.,n.d.,n.d.,n.d.,n.d.,n.d.,n.d.,n.d.,n.d.,n.d.,n.d.,n.d.,n.d.,n.d.,n.d.,n.d.,n.d.,n.d.,n.d.,n.d.,n.d.,n.d.,n.d.,n.d.,n.d.,n.d.,n.d.,n.d.,n.d.,n.d.,n.d.,n.d.,n.d.,n.d.,n.d.,n.d.,n.d.,n.d.,n.d.,n.d.,n.d.,n.d.,n.d.,n.d.,n.d.,n.d.,n.d.,n.d.,n.d.,n.d.,n.d.,n.d.,n.d.,n.d.,n.d.,n.d.,n.d.,n.d.,n.d.,n.d.,n.d.,n.d.,n.d.,n.d.,n.d.,n.d.,n.d.,n.d.,n.d.,n.d.,n.d.,n.d.
80,81,COMER INDUSTRIES S.P.A.,No,Sì,No,No,No,IT,2790,C1,2023,483900.712168694,863,VIA FERDINANDO MAGELLANO 27,42046.0,REGGIOLO,Italia,IT,IT,IT,Emilia-Romagna,,Western Europe,"The main activities of the Company core business is the design and production of advanced engineering systems and mechatronic solutions for power transmission. It operates in the agricultural machinery, construction and forestry equipment, energy and industry sectors.","L'azienda è stata fondata nel 1970 in Italia. L'attività principale dell'azienda è la progettazione e la produzione di sistemi avanzati di ingegneria e soluzioni meccatroniche per la trasmissione di potenza. Opera nel settore delle macchine agricole, delle attrezzature per la costruzione e la silvicoltura, dell'energia e dell'industria. La Società è quotata alla Borsa Italia.",Italian,Engineering systems and mechatronic solutions for power transmission applications [source: Bureau van Dijk],"The Company was created in the year 1970 in Italy. The main activities of the Company are related to the design and production of advanced engineering systems and mechatronic solutions for power transmission. It operates in the sector of agricultural machinery, construction equipment and for forestry, energy and industry. The Company is listed on the Italian Stock Exchange.",IT07210440157,IT07210440157IC,5331905,RE0182220,CCIAA number,Numero iscrizione al registro delle imprese,RE0182220,7210440157.0,IT01399270352,,,7210440157.0,815600BEB2A5426B0084,,815600BEB2A5426B0084,,,,31246EI,WVB number,COM,IT0005246191,,2024-07-22,World'Vest Base Inc.,,Very large company,Active,,2019-05-28,,,,Società per azioni,Società anonima - SA,No,1970,,,Azienda,,,,,,,n.d.,,,,,,EUR,n.d.,n.d.,n.d.,n.d.,n.d.,n.d.,n.d.,n.d.,n.d.,n.d.,n.d.,n.d.,n.d.,n.d.,n.d.,n.d.,n.d.,n.d.,n.d.,n.d.,n.d.,n.d.,n.d.,n.d.,n.d.,n.d.,n.d.,n.d.,n.d.,n.d.,n.d.,n.d.,n.d.,n.d.,n.d.,n.d.,n.d.,n.d.,n.d.,n.d.,n.d.,n.d.,n.d.,n.d.,n.d.,n.d.,n.d.,n.d.,n.d.,n.d.,n.d.,n.d.,n.d.,n.d.,n.d.,n.d.,n.d.,n.d.,n.d.,n.d.,n.d.,n.d.,n.d.,n.d.,n.d.,n.d.,n.d.,n.d.,n.d.,n.d.,n.d.,n.d.,n.d.,n.d.,n.d.,n.d.,n.d.,n.d.,n.d.,n.d.,n.d.,n.d.,n.d.,n.d.,n.d.,n.d.,n.d.,n.d.,n.d.,n.d.,n.d.,n.d.,n.d.,n.d.,n.d.,n.d.,n.d.,n.d.,n.d.,n.d.,n.d.,n.d.,n.d.,n.d.,n.d.,n.d.,n.d.,n.d.,n.d.,n.d.,n.d.,n.d.,n.d.,n.d.,n.d.,n.d.,n.d.,n.d.,n.d.,n.d.,n.d.,n.d.,n.d.,n.d.,n.d.,n.d.,n.d.,n.d.,n.d.,n.d.
81,82,ITALIAN WINE BRANDS S.P.A.,No,Sì,No,No,No,IT,4634,C2,2023,479057.494995117,376,VIA BRERA 16,20121.0,MILANO,Italia,IT,IT,IT,,,Western Europe,The main activies of the Company is related to production and distribution of wines.,La Società è stata creata nel 1900 in Italia. L'attività principale dell'Azienda è la produzione e distribuzione di vini L'Azienda è quotata alla Borsa Italiana.,Italian,Wines [source: Bureau van Dijk],The Company was created in 1900 in Italy. The Company is related to production and distribution of wines. The Company is listed on the Italian Stock Exchange.,IT08851780968,IT08851780968IC,224566808,MI2053323,CCIAA number,Numero iscrizione al registro delle imprese,MI2053323,8851780968.0,IT08851780968,,,8851780968.0,815600251190FB2E7172,,815600251190FB2E7172,,,,30503EI,WVB number,IWB,IT0005075764,IT0005075764,2024-05-16,World'Vest Base Inc.,,Very large company,Active,,2016-05-29,,,,Società per azioni,Società anonima - SA,No,1900,,,Azienda,,,,,,,n.d.,,,,,,EUR,n.d.,n.d.,n.d.,n.d.,n.d.,n.d.,n.d.,n.d.,n.d.,n.d.,n.d.,n.d.,n.d.,n.d.,n.d.,n.d.,n.d.,n.d.,n.d.,n.d.,n.d.,n.d.,n.d.,n.d.,n.d.,n.d.,n.d.,n.d.,n.d.,n.d.,n.d.,n.d.,n.d.,n.d.,n.d.,n.d.,n.d.,n.d.,n.d.,n.d.,n.d.,n.d.,n.d.,n.d.,n.d.,n.d.,n.d.,n.d.,n.d.,n.d.,n.d.,n.d.,n.d.,n.d.,n.d.,n.d.,n.d.,n.d.,n.d.,n.d.,n.d.,n.d.,n.d.,n.d.,n.d.,n.d.,n.d.,n.d.,n.d.,n.d.,n.d.,n.d.,n.d.,n.d.,n.d.,n.d.,n.d.,n.d.,n.d.,n.d.,n.d.,n.d.,n.d.,n.d.,n.d.,n.d.,n.d.,n.d.,n.d.,n.d.,n.d.,n.d.,n.d.,n.d.,n.d.,n.d.,n.d.,n.d.,n.d.,n.d.,n.d.,n.d.,n.d.,n.d.,n.d.,n.d.,n.d.,n.d.,n.d.,n.d.,n.d.,n.d.,n.d.,n.d.,n.d.,n.d.,n.d.,n.d.,n.d.,n.d.,n.d.,n.d.,n.d.,n.d.,n.d.,n.d.,n.d.,n.d.,n.d.,n.d.
82,83,TECHNOPROBE SPA,No,Sì,No,No,No,IT,2611,C1,2023,452247.972963333,2746,VIA CAVALIERI DI VITTORIO VENETO 2,,MILAN,Italia,IT,IT,IT,,,Western Europe,The Company principal activity is the manufacture of electronic probes.,L'azienda è stata fondata nel 1995 in Italia. L'attività principale dell'azienda è la fabbricazione di sonde elettroniche. La Società è quotata alla Borsa Italiana.,Italian,"Offer epoxy technology and vertical technology probe cards; Engineering experience, the two technologies have been optimised, reaching levels of excellence in vertical and epoxy technology; Epoxy technology offers the advantage of short delivery times, reduced costs, and advanced technological content due to many years of development [source: Bureau van Dijk]",The Company was established in 1995 in Italy. The Company principal activity is the manufacture of electronic probes. The Company is listed on the Italian Stock Exchange.,IT02272540135,IT02272540135IC,5277866,LC0283619,CCIAA number,Numero iscrizione al registro delle imprese,LC0283619,2272540135.0,IT02272540135,,,2272540135.0,8156007154CD8334D053,,8156007154CD8334D053,,,,31457EI,WVB number,TPRO,IT0005482333,,2024-04-01,World'Vest Base Inc.,,Very large company,Active,,,,,,Società per azioni,Società anonima - SA,No,1995,,,Azienda,,,,,,,n.d.,,,,,,EUR,n.d.,n.d.,n.d.,n.d.,n.d.,n.d.,n.d.,n.d.,n.d.,n.d.,n.d.,n.d.,n.d.,n.d.,n.d.,n.d.,n.d.,n.d.,n.d.,n.d.,n.d.,n.d.,n.d.,n.d.,n.d.,n.d.,n.d.,n.d.,n.d.,n.d.,n.d.,n.d.,n.d.,n.d.,n.d.,n.d.,n.d.,n.d.,n.d.,n.d.,n.d.,n.d.,n.d.,n.d.,n.d.,n.d.,n.d.,n.d.,n.d.,n.d.,n.d.,n.d.,n.d.,n.d.,n.d.,n.d.,n.d.,n.d.,n.d.,n.d.,n.d.,n.d.,n.d.,n.d.,n.d.,n.d.,n.d.,n.d.,n.d.,n.d.,n.d.,n.d.,n.d.,n.d.,n.d.,n.d.,n.d.,n.d.,n.d.,n.d.,n.d.,n.d.,n.d.,n.d.,n.d.,n.d.,n.d.,n.d.,n.d.,n.d.,n.d.,n.d.,n.d.,n.d.,n.d.,n.d.,n.d.,n.d.,n.d.,n.d.,n.d.,n.d.,n.d.,n.d.,n.d.,n.d.,n.d.,n.d.,n.d.,n.d.,n.d.,n.d.,n.d.,n.d.,n.d.,n.d.,n.d.,n.d.,n.d.,n.d.,n.d.,n.d.,n.d.,n.d.,n.d.,n.d.,n.d.,n.d.,n.d.,n.d.
