251,152,NVP S.P.A.,No,Sì,No,No,No,IT,6190,C1,2023,31172.0639896393,199,"VIA DI SCORTICABOVE, 138",20121.0,"ROME, ROME",Italia,IT,IT,IT,,,Western Europe,"The Company main activity is to provide high-tech equipment and ultra-specialized personnel for the realization of great television programs, sports, cinema, television, fiction, concerts and shows, as well as having acquired a great experience in techniques, art, content of new TV stations, corporate TV, fibers and new transmission technologies in general.","La Società è stata costituita il 2 maggio 2007 in Italia. L'attività principale della Società è quella di fornire attrezzature ad alto contenuto tecnologico e personale ultra specializzato per la realizzazione di grandi programmi televisivi, sportivi, cinematografici, televisivi, di fiction, concerti e spettacoli, oltre ad aver acquisito una grande esperienza nelle tecniche, nell'arte, nei contenuti di nuove emittenti televisive, tv aziendale, fibra e nuove tecnologie di trasmissione in genere. La Società è quotata alla Borsa di Milano.",Italian,"Sport events, TV programs and iconic events to the public [source: Bureau van Dijk]","The Company was created on May 2, 2007 in Italy. The Company main activity is to provide high-tech equipment and ultra-specialized personnel for the realization of great television programs, sports, cinema, television, fiction, concerts and shows, as well as having acquired a great experience in techniques, art, content of new TV stations, corporate TV, fibers and new transmission technologies in general. The Company is listed on the Milan Stock Exchange.",IT02916630839,IT02916630839IC,46969207,ME0201584,CCIAA number,Numero iscrizione al registro delle imprese,ME0201584,2916630839.0,IT02916630839,,,2916630839.0,8156002021E73BAE6923,,8156002021E73BAE6923,,,,31297EI,WVB number,NVP,IT0005390783,,2024-06-18,World'Vest Base Inc.,,Very large company,Active,,,,,,Società per azioni,Società anonima - SA,No,2007,,,Azienda,,,,,,,n.d.,,,,,,EUR,n.d.,n.d.,n.d.,n.d.,n.d.,n.d.,n.d.,n.d.,n.d.,n.d.,n.d.,n.d.,n.d.,n.d.,n.d.,n.d.,n.d.,n.d.,n.d.,n.d.,n.d.,n.d.,n.d.,n.d.,n.d.,n.d.,n.d.,n.d.,n.d.,n.d.,n.d.,n.d.,n.d.,n.d.,n.d.,n.d.,n.d.,n.d.,n.d.,n.d.,n.d.,n.d.,n.d.,n.d.,n.d.,n.d.,n.d.,n.d.,n.d.,n.d.,n.d.,n.d.,n.d.,n.d.,n.d.,n.d.,n.d.,n.d.,n.d.,n.d.,n.d.,n.d.,n.d.,n.d.,n.d.,n.d.,n.d.,n.d.,n.d.,n.d.,n.d.,n.d.,n.d.,n.d.,n.d.,n.d.,n.d.,n.d.,n.d.,n.d.,n.d.,n.d.,n.d.,n.d.,n.d.,n.d.,n.d.,n.d.,n.d.,n.d.,n.d.,n.d.,n.d.,n.d.,n.d.,n.d.,n.d.,n.d.,n.d.,n.d.,n.d.,n.d.,n.d.,n.d.,n.d.,n.d.,n.d.,n.d.,n.d.,n.d.,n.d.,n.d.,n.d.,n.d.,n.d.,n.d.,n.d.,n.d.,n.d.,n.d.,n.d.,n.d.,n.d.,n.d.,n.d.,n.d.,n.d.,n.d.,n.d.,n.d.
252,153,NOVAMARINE S.P.A.,No,No,No,No,No,IT,3012,U1,2023,30039.8318615074,71,VLE GIUSEPPE MAZZINI 114/A,195.0,ROMA,Italia,IT,IT,IT,Lazio,,Western Europe,"Engaged in building, repairing and maintaining ships and boats [source: Bureau van Dijk]",COSTRUZIONE DI IMBARCAZIONI DA DIPORTO E SPORTIVE,Italian,Ships and boats [source: Bureau van Dijk],,IT10099691007,IT10099691007U,73165705,RM1558976,CCIAA number,Numero iscrizione al registro delle imprese,RM1558976,10099691007.0,IT10099691007,,,10099691007.0,894500BS6Y4BQZMJ5E76,,894500BS6Y4BQZMJ5E76,,,,,,NOVA,IT0005605701,,2024-09-18,Cerved,,Large company,Active,,,,,,Società per azioni,Società per azioni - S.P.A. - SPA,No,2008-07-14 00:00:00,,,Azienda,,,,,,,n.d.,,,,,,EUR,n.d.,n.d.,n.d.,n.d.,n.d.,n.d.,n.d.,n.d.,n.d.,n.d.,n.d.,n.d.,n.d.,n.d.,n.d.,n.d.,n.d.,n.d.,n.d.,n.d.,n.d.,n.d.,n.d.,n.d.,n.d.,n.d.,n.d.,n.d.,n.d.,n.d.,n.d.,n.d.,n.d.,n.d.,n.d.,n.d.,n.d.,n.d.,n.d.,n.d.,n.d.,n.d.,n.d.,n.d.,n.d.,n.d.,n.d.,n.d.,n.d.,n.d.,n.d.,n.d.,n.d.,n.d.,n.d.,n.d.,n.d.,n.d.,n.d.,n.d.,n.d.,n.d.,n.d.,n.d.,n.d.,n.d.,n.d.,n.d.,n.d.,n.d.,n.d.,n.d.,n.d.,n.d.,n.d.,n.d.,n.d.,n.d.,n.d.,n.d.,n.d.,n.d.,n.d.,n.d.,n.d.,n.d.,n.d.,n.d.,n.d.,n.d.,n.d.,n.d.,n.d.,n.d.,n.d.,n.d.,n.d.,n.d.,n.d.,n.d.,n.d.,n.d.,n.d.,n.d.,n.d.,n.d.,n.d.,n.d.,n.d.,n.d.,n.d.,n.d.,n.d.,n.d.,n.d.,n.d.,n.d.,n.d.,n.d.,n.d.,n.d.,n.d.,n.d.,n.d.,n.d.,n.d.,n.d.,n.d.,n.d.,n.d.
253,154,LINDBERGH S.P.A,No,Sì,No,No,No,IT,7022,C1,2023,29736.6683454514,144,VIA GIUSEPPE GUARNERI ZANETTI 22,26033.0,CREMONA,Italia,IT,IT,IT,Lombardia,,Western Europe,The main activity of the Company is related to provide technical maintenance services and personnel to provide maintenance services.,L'azienda è stata fondata nel 2006 in Italia. L'attività principale dell'azienda è quella di fornire servizi di manutenzione tecnica e personale per fornire servizi di manutenzione. La Società è quotata alla Borsa Italiana.,Italian,"Disposal of waste, spare parts delivery, returns management and repair, PPE supply, washing of work clothes, check tools, and other services [source: Bureau van Dijk]",The Company was founded in 2006 in Italy. The main activity of the Company is related to provide technical maintenance services and personnel to provide maintenance services. The Company is listed on the Italian Stock Exchange.,IT02392670341,IT02392670341IC,37367401,CR0181500,CCIAA number,Numero iscrizione al registro delle imprese,CR0181500,2392670341.0,IT02392670341,,,2392670341.0,894500X4YZLMBENRLF77,,894500X4YZLMBENRLF77,,,,31450EI,WVB number,LDB,IT0005469272,,2024-05-30,World'Vest Base Inc.,,Very large company,Active,,,,,,Società per azioni,Società anonima - SA,No,2006,,,Azienda,,,,,,,n.d.,,,,,,EUR,n.d.,n.d.,n.d.,n.d.,n.d.,n.d.,n.d.,n.d.,n.d.,n.d.,n.d.,n.d.,n.d.,n.d.,n.d.,n.d.,n.d.,n.d.,n.d.,n.d.,n.d.,n.d.,n.d.,n.d.,n.d.,n.d.,n.d.,n.d.,n.d.,n.d.,n.d.,n.d.,n.d.,n.d.,n.d.,n.d.,n.d.,n.d.,n.d.,n.d.,n.d.,n.d.,n.d.,n.d.,n.d.,n.d.,n.d.,n.d.,n.d.,n.d.,n.d.,n.d.,n.d.,n.d.,n.d.,n.d.,n.d.,n.d.,n.d.,n.d.,n.d.,n.d.,n.d.,n.d.,n.d.,n.d.,n.d.,n.d.,n.d.,n.d.,n.d.,n.d.,n.d.,n.d.,n.d.,n.d.,n.d.,n.d.,n.d.,n.d.,n.d.,n.d.,n.d.,n.d.,n.d.,n.d.,n.d.,n.d.,n.d.,n.d.,n.d.,n.d.,n.d.,n.d.,n.d.,n.d.,n.d.,n.d.,n.d.,n.d.,n.d.,n.d.,n.d.,n.d.,n.d.,n.d.,n.d.,n.d.,n.d.,n.d.,n.d.,n.d.,n.d.,n.d.,n.d.,n.d.,n.d.,n.d.,n.d.,n.d.,n.d.,n.d.,n.d.,n.d.,n.d.,n.d.,n.d.,n.d.,n.d.,n.d.
254,155,DOXEE S.P.A.,No,Sì,No,No,No,IT,4741,C1,2023,29517.878247261,188,VIALE VIRGILIO 48 / B,41123.0,"MODENA, MODENA",Italia,IT,IT,IT,Emilia-Romagna,,Western Europe,The main activities of the Company is related to offer technology products and delivered in Cloud mode to companies in the Enterprise segment.,La Società è stata creata nel 2001 in Italia. La Società è correlata all'offerta di prodotti tecnologici basati su una piattaforma proprietaria e brevettata (Doxee Enterprise Communications Platform) e forniti in modalità Cloud alle aziende del segmento Enterprise. La Società è quotata sulla Borsa italiana.,Italian,"Provides outsourcing for the management of business communication documents, including personalized business communication documents; and manages application management, processing of documentary flows, document delivery and filing [source: Bureau van Dijk]","The Company was created in 2001 in Italia. The Company is related to offer technology products based on a proprietary, patented platform (Doxee Enterprise Communications Platform), and delivered in Cloud mode to companies in the Enterprise segment. The Company is listed in the Stock Exchange of Italia.",IT02714390362,IT02714390362IC,9492171,MO0324846,CCIAA number,Numero iscrizione al registro delle imprese,MO0324846,2714390362.0,IT02714390362,,,2714390362.0,81560017F8F8BDF14D31,,81560017F8F8BDF14D31,,,,31285EI,WVB number,DOX,IT0005394413,,2024-06-28,World'Vest Base Inc.,,Very large company,Active,,2020-10-21,,,,Società per azioni,Società anonima - SA,No,2001,,,Azienda,,,,,,,n.d.,,,,,,EUR,n.d.,n.d.,n.d.,n.d.,n.d.,n.d.,n.d.,n.d.,n.d.,n.d.,n.d.,n.d.,n.d.,n.d.,n.d.,n.d.,n.d.,n.d.,n.d.,n.d.,n.d.,n.d.,n.d.,n.d.,n.d.,n.d.,n.d.,n.d.,n.d.,n.d.,n.d.,n.d.,n.d.,n.d.,n.d.,n.d.,n.d.,n.d.,n.d.,n.d.,n.d.,n.d.,n.d.,n.d.,n.d.,n.d.,n.d.,n.d.,n.d.,n.d.,n.d.,n.d.,n.d.,n.d.,n.d.,n.d.,n.d.,n.d.,n.d.,n.d.,n.d.,n.d.,n.d.,n.d.,n.d.,n.d.,n.d.,n.d.,n.d.,n.d.,n.d.,n.d.,n.d.,n.d.,n.d.,n.d.,n.d.,n.d.,n.d.,n.d.,n.d.,n.d.,n.d.,n.d.,n.d.,n.d.,n.d.,n.d.,n.d.,n.d.,n.d.,n.d.,n.d.,n.d.,n.d.,n.d.,n.d.,n.d.,n.d.,n.d.,n.d.,n.d.,n.d.,n.d.,n.d.,n.d.,n.d.,n.d.,n.d.,n.d.,n.d.,n.d.,n.d.,n.d.,n.d.,n.d.,n.d.,n.d.,n.d.,n.d.,n.d.,n.d.,n.d.,n.d.,n.d.,n.d.,n.d.,n.d.,n.d.,n.d.
255,156,SOFTLAB S.P.A.,No,Sì,No,No,No,IT,6190,C1,2023,29259.308131218,269,VIA DELLA VALLE DEI FONTANILI 29/37,168.0,ROMA,Italia,IT,IT,IT,,,Western Europe,"The main activity of the Company is related to the operation in the information and communications technology (ITC) industry. It operates in four business areas: Value added services, which provide services to end customers (B2C) and telephone and commercial companies.","L'azienda è stata creata nel 1980 in Italia. L'attività principale della Società è legata all'operatività nel settore delle tecnologie dell'informazione e della comunicazione (ITC). Opera in quattro aree di business: servizi a valore aggiunto, che forniscono servizi ai clienti finali (B2C) e società telefoniche e commerciali. La Società è quotata alla Borsa Italiana.",Italian,Information and communications technology [source: Bureau van Dijk],"The Company was founded in 1980 in Italy. The main activity of the Company is related to the operation in the information and communications technology (ITC) industry. It operates in four business areas: Value added services, which provide services to end customers (B2C) and telephone and commercial companies. The Company is listed on the Italian Stock Exchange.",IT06075181005,IT06075181005IC,60527507,06075181005,Codice fiscale,Codice fiscale/P. IVA,,6075181005.0,,,,,815600EE82868C20A274,,815600EE82868C20A274,,,,30176EI,WVB number,SOF,IT0001469953,,2024-06-25,World'Vest Base Inc.,,Very large company,Active,,,,,,Società per azioni,Società anonima - SA,No,1980,,,Azienda,,,,2010-12-31,2010.0,,12,Unqualified,Original,IFRS,AR,thousands,EUR,1.33689844608307,206570.863396525,1934.4920514822,-2993.31562077999,1739.30487835407,136978.614785671,91026.741396904,2.499,0.936,2.125,3.222,66.453,479,31201.8728331327,17529.4124250412,9073.52975356579,4598.93065452576,105776.741952538,687.165801286697,42767.3812901974,62322.1948610544,52105.6169360876,136978.614785671,91026.741396904,1449.19791555405,89577.5434813499,3625.66858577728,46.7914456129074,3578.87714016438,2204.54553759098,42326.20480299,5081.55099356174,25844.9207596779,11399.7330497503,136978.614785671,17609.6263318062,63450.5371495485,201896.259406323,479,206570.863396525,206001.344658494,115578.88135922,90991.9820373058,88838.238640666,2153.74339663982,-219.251345157623,1505.34765028954,1724.59899544716,1934.4920514822,4593.58306074142,-2659.09100925922,-334.224611520767,n.d.,n.d.,-2993.31562077999,n.d.,1636.36369800568,30632.3540951014,4732.62049913406,53473.2640464306,1114.97330403328,0,1739.30487835407,38080.2153382301,6886.36389577389,n.d.,n.d.,n.d.,n.d.,n.d.,n.d.,n.d.,n.d.,n.d.,n.d.,n.d.,n.d.,n.d.,n.d.,n.d.,n.d.,n.d.,n.d.,n.d.,n.d.,n.d.,n.d.,n.d.,n.d.,n.d.,n.d.,n.d.,n.d.,n.d.,n.d.,n.d.,n.d.,2.125,3.222,1.412,-3.288,-1.984,-2.185,0.936,44.049,3.334,1.043,0.842,29.318,n.d.,2.182,1.932,300.613,74.533,45.041,n.d.,0,2.499,2.483,25.106,66.453,n.s.,9.566,4.03860576710808,431.254411967337,14.829,63.9506347619702,190.034951008909,36.7633115453067,285.967881093304
256,157,PHILOGEN S.P.A,No,Sì,No,No,No,IT,2120,C1,2023,27759.8224582672,160,"PIAZZA LA LIZZA, 7",53100.0,"SIENA, SIENA",Italia,IT,IT,IT,Toscana,,Western Europe,The main activity of the Company is to develop innovative biopharmaceutical products for the treatment of disorders related to angiogenesis.,La Società è stata costituita il 19 aprile 1996 in Italia. L'attività principale della Società è quella di sviluppare prodotti biofarmaceutici innovativi per il trattamento dei disturbi legati all'angiogenesi. La Società è quotata alla Borsa di Italia.,Italian,Focuses on the development of new biopharmaceuticals for the treatment of angiogenesis-related disorders [source: Bureau van Dijk],"The Company was created on April 19, 1996 in Italy. The main activity of the Company is to develop innovative biopharmaceutical products for the treatment of disorders related to angiogenesis. The Company is listed on the Italy Stock Exchange.",IT00893990523,IT00893990523IC,8064408,SI0098772,CCIAA number,Numero iscrizione al registro delle imprese,SI0098772,893990523.0,IT00893990523,,,893990523.0,81560009EA1577917768,,81560009EA1577917768,,,,31406EI,WVB number,PHIL,IT0005373789,,2024-05-13,World'Vest Base Inc.,,Very large company,Active,,,,,,Società per azioni,Società anonima - SA,No,1996,,,Azienda,,,,,,,n.d.,,,,,,EUR,n.d.,n.d.,n.d.,n.d.,n.d.,n.d.,n.d.,n.d.,n.d.,n.d.,n.d.,n.d.,n.d.,n.d.,n.d.,n.d.,n.d.,n.d.,n.d.,n.d.,n.d.,n.d.,n.d.,n.d.,n.d.,n.d.,n.d.,n.d.,n.d.,n.d.,n.d.,n.d.,n.d.,n.d.,n.d.,n.d.,n.d.,n.d.,n.d.,n.d.,n.d.,n.d.,n.d.,n.d.,n.d.,n.d.,n.d.,n.d.,n.d.,n.d.,n.d.,n.d.,n.d.,n.d.,n.d.,n.d.,n.d.,n.d.,n.d.,n.d.,n.d.,n.d.,n.d.,n.d.,n.d.,n.d.,n.d.,n.d.,n.d.,n.d.,n.d.,n.d.,n.d.,n.d.,n.d.,n.d.,n.d.,n.d.,n.d.,n.d.,n.d.,n.d.,n.d.,n.d.,n.d.,n.d.,n.d.,n.d.,n.d.,n.d.,n.d.,n.d.,n.d.,n.d.,n.d.,n.d.,n.d.,n.d.,n.d.,n.d.,n.d.,n.d.,n.d.,n.d.,n.d.,n.d.,n.d.,n.d.,n.d.,n.d.,n.d.,n.d.,n.d.,n.d.,n.d.,n.d.,n.d.,n.d.,n.d.,n.d.,n.d.,n.d.,n.d.,n.d.,n.d.,n.d.,n.d.,n.d.,n.d.,n.d.
257,158,FOS S.P.A.,No,Sì,No,No,No,IT,6201,C1,2023,26815.0470342636,255,VIA MILANO 166 N / R,16126.0,GENOVA,Italia,IT,IT,IT,,,Western Europe,"The main activity of the company is the integration of software development systems and services, outsourcing of applications and infrastructures, research, development and prototyping of innovative technological solutions, telecommunications services. It operates in several markets: industry and services, finance, health and medicine, telecommunications and public services, public administration.","La Società è stata creata nel 14 maggio 1999in Italia. L'attività principale della Società è costituita da servizi di integrazione di sistemi e sviluppo software, esternalizzazione di applicazioni e infrastrutture, ricerca, sviluppo e prototipazione di soluzioni tecnologiche innovative, servizi di telecomunicazione. E opera trasversalmente in vari mercati: industria e servizi, finanza, sanità e medicina, telecomunicazioni e servizi pubblici, pubblica amministrazione.La Società è quotata alla Borsa di Italia.",Italian,"System integration and software development services, application and infrastructure outsourcing, research, development and prototyping of innovative technological solutions, and telecommunications services [source: Bureau van Dijk]","The Company was created on May 14 1999 in Italy. The main activity of The Company is the integration of software development systems and services, outsourcing of applications and infrastructures, research, development and prototyping of innovative technological solutions, telecommunications services. It operates in several markets: industry and services, finance, health and medicine, telecommunications and public services, public administration. The Company is listed on the Milan Stock Exchange.",IT12851070156,IT12851070156IC,8052265,MI1592286,CCIAA number,Numero iscrizione al registro delle imprese,MI1592286,12851070156.0,IT12851070156,,,12851070156.0,815600CACFC253494A80,,815600CACFC253494A80,,,,31288EI,WVB number,FOS,IT0005388217,,2024-07-09,World'Vest Base Inc.,,Very large company,Active,,2020-06-18,,,,Società per azioni,Società anonima - SA,No,1999,,,Azienda,,,,,,,n.d.,,,,,,EUR,n.d.,n.d.,n.d.,n.d.,n.d.,n.d.,n.d.,n.d.,n.d.,n.d.,n.d.,n.d.,n.d.,n.d.,n.d.,n.d.,n.d.,n.d.,n.d.,n.d.,n.d.,n.d.,n.d.,n.d.,n.d.,n.d.,n.d.,n.d.,n.d.,n.d.,n.d.,n.d.,n.d.,n.d.,n.d.,n.d.,n.d.,n.d.,n.d.,n.d.,n.d.,n.d.,n.d.,n.d.,n.d.,n.d.,n.d.,n.d.,n.d.,n.d.,n.d.,n.d.,n.d.,n.d.,n.d.,n.d.,n.d.,n.d.,n.d.,n.d.,n.d.,n.d.,n.d.,n.d.,n.d.,n.d.,n.d.,n.d.,n.d.,n.d.,n.d.,n.d.,n.d.,n.d.,n.d.,n.d.,n.d.,n.d.,n.d.,n.d.,n.d.,n.d.,n.d.,n.d.,n.d.,n.d.,n.d.,n.d.,n.d.,n.d.,n.d.,n.d.,n.d.,n.d.,n.d.,n.d.,n.d.,n.d.,n.d.,n.d.,n.d.,n.d.,n.d.,n.d.,n.d.,n.d.,n.d.,n.d.,n.d.,n.d.,n.d.,n.d.,n.d.,n.d.,n.d.,n.d.,n.d.,n.d.,n.d.,n.d.,n.d.,n.d.,n.d.,n.d.,n.d.,n.d.,n.d.,n.d.,n.d.,n.d.
258,159,SYS-DAT S.P.A.,No,No,No,No,No,IT,6201,U1,2023,26773.057015419,128,VIA MUZIO ATTENDOLO DETTO SFORZA 7,20141.0,MILANO,Italia,IT,IT,IT,Lombardia,,Western Europe,Engaged in the development of software platforms and solutions [source: Bureau van Dijk],PRODUZIONE DI SOFTWARE NON CONNESSO ALL'EDIZIONE,Italian,"System integration projects (strategy and IT consulting, solutions and architectures within enterprises, systems development, project management, and e-business solutions) and outsourcing projects (application management, data transmission networks, distributed systems, operating systems, and legacy systems) [source: Bureau van Dijk]",,IT03699600155,IT03699600155U,5287324,MI0963005,CCIAA number,Numero iscrizione al registro delle imprese,MI0963005,3699600155.0,IT03699600155,,,3699600155.0,81560077224E78407E81,,81560077224E78407E81,,,,,,SYS,IT0005595423,,2024-09-18,Cerved,,Large company,Active,,,,,,Società per azioni,Società per azioni - S.P.A. - SPA,No,1977-05-02 00:00:00,,,Azienda,,,,,,,n.d.,,,,,,EUR,n.d.,n.d.,n.d.,n.d.,n.d.,n.d.,n.d.,n.d.,n.d.,n.d.,n.d.,n.d.,n.d.,n.d.,n.d.,n.d.,n.d.,n.d.,n.d.,n.d.,n.d.,n.d.,n.d.,n.d.,n.d.,n.d.,n.d.,n.d.,n.d.,n.d.,n.d.,n.d.,n.d.,n.d.,n.d.,n.d.,n.d.,n.d.,n.d.,n.d.,n.d.,n.d.,n.d.,n.d.,n.d.,n.d.,n.d.,n.d.,n.d.,n.d.,n.d.,n.d.,n.d.,n.d.,n.d.,n.d.,n.d.,n.d.,n.d.,n.d.,n.d.,n.d.,n.d.,n.d.,n.d.,n.d.,n.d.,n.d.,n.d.,n.d.,n.d.,n.d.,n.d.,n.d.,n.d.,n.d.,n.d.,n.d.,n.d.,n.d.,n.d.,n.d.,n.d.,n.d.,n.d.,n.d.,n.d.,n.d.,n.d.,n.d.,n.d.,n.d.,n.d.,n.d.,n.d.,n.d.,n.d.,n.d.,n.d.,n.d.,n.d.,n.d.,n.d.,n.d.,n.d.,n.d.,n.d.,n.d.,n.d.,n.d.,n.d.,n.d.,n.d.,n.d.,n.d.,n.d.,n.d.,n.d.,n.d.,n.d.,n.d.,n.d.,n.d.,n.d.,n.d.,n.d.,n.d.,n.d.,n.d.,n.d.
259,160,POLIGRAFICI PRINTING SPA,No,Sì,No,No,No,IT,1812,C1,2023,26679.1319732666,75,VIA ENRICO MATTEI 106,40138.0,BOLOGNA,Italia,IT,IT,IT,Emilia-Romagna,,Western Europe,The main activities of the Company is related to active in the media industry.,La Società è stata fondata nel 2007 in Italia. La Società è una società italiana attiva nel settore dei media. La Società è quotata alla Borsa Italiana.,Italian,Heat and cold-set web offset printing [source: Bureau van Dijk],The Company was founded in 2007 in Italia. The main activities of the Company is related to active in the media industry. The Company is listed in the Stock Exchange of Italia.,IT02792021202,IT02792021202IC,51056598,BO0467980,CCIAA number,Numero iscrizione al registro delle imprese,BO0467980,2792021202.0,IT02792021202,,,2792021202.0,8156001749FD9F374D04,,8156001749FD9F374D04,,,,30423EI,WVB number,POPR,IT0004587470,,2024-08-28,World'Vest Base Inc.,,Very large company,Active,,,,,,Società per azioni,Società anonima - SA,No,2007,,,Azienda,,,,2010-12-31,2010.0,,12,Unqualified,Original,IFRS,AR,thousands,EUR,1.33689844608307,91725.9392842054,1045.45458483696,569.518738031387,10344.9201757908,125295.459265351,44405.0818866491,1.02,1.14,2.354,2.496,35.44,233,81750.0030795336,462.566862344742,78878.3452173471,2409.09099984169,43545.4561858177,6768.71683251858,16935.8295149803,19840.9098383188,5179.14458012581,125295.459265351,44405.0818866491,40763.3705195189,3641.71136713028,38192.5148077011,550.802159786224,37641.7126479149,4938.50285983086,42697.8625710011,14613.636914134,15299.4658169746,12784.7598398924,125295.459265351,8405.08053052425,847.593614816666,45188.6980541285,233,91725.9392842054,90550.8055500984,49217.9162925482,42508.0229916573,40671.1245267391,1836.89846491814,-791.443880081177,179.144391775131,970.588271856308,1045.45458483696,475.935846805573,569.518738031387,0,n.d.,n.d.,569.518738031387,n.d.,27028.0758844614,21974.5997582674,9775.4014377594,8921.12333071232,1016.04281902313,0,10344.9201757908,33811.4985998869,11612.2999026775,n.d.,n.d.,n.d.,n.d.,n.d.,n.d.,n.d.,n.d.,n.d.,n.d.,n.d.,n.d.,n.d.,n.d.,n.d.,n.d.,n.d.,n.d.,n.d.,n.d.,n.d.,n.d.,n.d.,n.d.,n.d.,n.d.,n.d.,n.d.,n.d.,n.d.,n.d.,n.d.,2.354,2.496,0.834,1.283,1.92,0.455,1.14,46.342,12.66,2.003,11.278,3.891,n.d.,1.111,1.808,13.551,66.469,60.046,n.d.,0,1.02,0.861,1.163,35.44,54.895,118.919,4.48692931340826,393.673558947383,23.957,94.3115864404306,190.579750494673,36.0733075086189,537.748752877388
260,161,CHL SPA,No,Sì,No,No,No,IT,4729,C1,2018,26657.9034330845,n.d.,VIA DI MARCONI 128,50131.0,FIRENZE,Italia,IT,IT,IT,,,Western Europe,"The Company was created in 1993 primarily engaged in the sector of electronic commerce (e-commerce). Through its online platform, the Company provides e-commerce services, as well as distribution, logistics and customer services. The Company's e-commerce platform offers a range of products, such as computer software and hardware, audiovisual equipment, telephony, photography, publishing, sports, hobbies, consumer electronics and kitchen accessories, among others.","L'azienda è stata fondata nel 1993. La Società è una società italiana che opera nel settore IT con le aziende che forniscono servizi a elevate prestazioni attraverso la sua piattaforma avanzata tecnologia proprietaria. La holding italiana che detiene partecipazioni di controllo:
1) FARMACHL Srl, il 51%, che opera nel campo della farmaceutica per-franchising nel paese, specializzato in omeopatia e cosmetici di alta qualità, è un distributore di prodotti all'ingrosso e prodotti di bellezza dei prodotti a marchio proprio . Farmachl fornisce anche servizi estetici e macchinari all'avanguardia dedicato e di consulenza attraverso la propria rete di farmacie in franchising esclusivi. La società distribuisce e commercializza apparecchiature estetiche avanzate con il proprio marchio per saloni di bellezza e settore professionale.
2) S.p.A. FRAEL controllata al 100% attiva nel settore delle tecnologie della comunicazione con la produzione e la commercializzazione di prodotti ad alta tecnologia per marcare 'Frael' e
distribuzione di altri marchi attraverso distributori e rivenditori. Nell'ambito del progetto '@ Scuol 2.0' e Cl @ ssi 2.0 Frael offerte, istituti scolastici che partecipano al piano scuola digitale, un insegnamento completo servizio è la fornitura di dispositivi mobili, proiettori multimediali e altri strumenti Web 2.0 con il supporto dei docenti nelle fasi successive di formazione.",Italian,"Operates an online platform that offers a range of products, such as computer software and hardware, audiovisual equipment, telephony, photography, publishing, sports, hobbies, consumer electronics, cosmetics, and kitchen accessories, as well as distribution, logistics, and transport support services [source: Bureau van Dijk]","The Company was created in 1993. The Company is an Italian company operating in the IT industry with companies providing services to high performance through its advanced proprietary technology platform. The Italian holding company that owns controlling:
1) FARMACHL Srl, 51%, operating in the field of pharmaceutical for-franchise in the country, specializing in homeopathy and high quality cosmetics, is a distributor of wholesale products and beauty products of own brand products . Farmachl also provides aesthetic services and dedicated advanced machinery and consulting through its own network of exclusive franchise pharmacies. The company also distributes and markets advanced aesthetic equipment under its own brand for beauty salons and professional sector.
2) S.p.A. FRAEL a 100% subsidiary active in the field of communication technology with production and marketing of high-tech products to mark 'Frael' and
distribution of other brands through distributors and resellers. As part of the project '@ Scuol 2.0' and Cl @ ssi 2.0 Frael offers, educational institutions participating in the Digital school plan, a full service teaching is the provision of mobile devices, multimedia projectors and Web other tools 2.0 together with the support of teachers in the next phases of training.
The Company is listed in the Stock Exchange of Italia.",IT04610960488,IT04610960488IC,5271338,FI0465765,CCIAA number,Numero iscrizione al registro delle imprese,FI0465765,4610960488.0,IT04610960488,,,4610960488.0,815600C8161A8FD5C295,,815600C8161A8FD5C295,,,,30163EI,WVB number,CHL,IT0001446613,,2020-03-04,World'Vest Base Inc.,,Very large company,Active,,,,,,Società per azioni,Società anonima - SA,No,1993,,,Azienda,,,,2010-12-31,2010.0,,12,Unqualified,Original,IFRS,AR,thousands,EUR,1.33689844608307,28344.9208538532,-2203.2086391449,-2327.54019463062,-2020.05355203152,37116.3115586042,20510.6959598064,1.163,-7.773,-10.742,-7.458,55.261,30,23110.963437438,15407.7545911074,7129.67941296101,573.529433369637,14005.3481211662,2819.51882278919,6351.60451734066,4834.22478103638,862.299497723579,37116.3115586042,20510.6959598064,20430.4820530415,80.2139067649841,4568.18199026585,3766.042922616,802.139067649841,802.139067649841,12037.433608532,4780.74884319305,6000.00022602081,1256.68453931808,37116.3115586042,3171.12311410904,1967.91451263428,34692.3969560719,30,28344.9208538532,27410.4288400412,27513.3700203896,831.550833463669,2815.50812745094,-1983.95729398727,-219.251345157623,113.636367917061,332.887713074684,-2203.2086391449,124.331555485725,-2327.54019463062,n.d.,n.d.,n.d.,-2327.54019463062,n.d.,23413.1024862528,1467.91449379921,307.486642599106,1040.10699105263,332.887713074684,0,-2020.05355203152,-94.9197896718979,-1676.47065138817,n.d.,n.d.,n.d.,n.d.,n.d.,n.d.,n.d.,n.d.,n.d.,n.d.,n.d.,n.d.,n.d.,n.d.,n.d.,n.d.,n.d.,n.d.,n.d.,n.d.,n.d.,n.d.,n.d.,n.d.,n.d.,n.d.,n.d.,n.d.,n.d.,n.d.,n.d.,n.d.,-10.742,-7.458,-5.936,-11.348,-7.954,-6.271,-7.773,2.934,-5.915,-6.999,-7.127,n.s.,n.d.,1.13,-5.96,10.053,80.67,76.204,n.d.,0,1.163,0.929,4.49,55.261,n.s.,45.581,-73.4402875258638,944.830694682808,5.179,48.9304831266403,683.689865326881,105.704104249267,1237.21038484118
